19318000,CAUCA,GUAPI,GUAPI,ESTATAL,MUNICIPAL,BIBLIOTECA PÚBLICA MUNICIPAL HELCÍAS MARTÁN GONGORA,CARRERA 6A CALLE 12,Americas,3217832870/3137677429/0,,0,http://guapi-cauca.gov.co,ABIERTA,"(2.5728600°,-77.8889500°)"
5376000,ANTIOQUIA,LA CEJA,LA CEJA,ESTATAL,MUNICIPAL,PARQUE BIBLIOTECA EL PARAISO,Carrera 16 Nº 7D - 8,El Paraiso,5680296/3127916227/4186106,,5680296,www.laceja-antioquia.gov.co,ABIERTA,"(6.0216155°,-75.4313338°)"
5667000,ANTIOQUIA,SAN RAFAEL,SAN RAFAEL,ESTATAL,MUNICIPAL,BIBLIOTECA PÚBLICA RAFAEL POMBO,CALLE 18A N°  17-17,PARQUE DE LA MADRE,8586533/3206981250/8586435,0,0,http://bpmsanrafael.blogspot.com/,ABIERTA,"(6.2787795°,-75.1354602°)"
5847000,ANTIOQUIA,URRAO,URRAO,ESTATAL,MUNICIPAL,BIBLIOTECA PÚBLICA MUNICIPAL ANTONIO JOSÉ ARANGO,Carrera 31 # 24 - 06,ZONA URBANA,8502317/3192890591/,,,http://urrao-antioquia.gov.co/index.shtml,ABIERTA,"(6.3159552°,-76.1298323°)"
63190000,QUINDIO,CIRCASIA,CIRCASIA,ESTATAL,MUNICIPAL,BIBLIOTECA PÚBLICA MUNICIPAL DE CIRCASIA,CALLE 6ª N° 15 - 45,CENTRO,3178643465/3137702581/7584062,,,https://www.facebook.com/profile.php?id=1000126211,ABIERTA,"(4.6209495°,-75.6343884°)"
70001000,SUCRE,SINCELEJO,SINCELEJO,ESTATAL,DEPARTAMENTAL,BIBLIOTECA PÚBLICA DEPARTAMENTAL DE SUCRE JOSE ELIAS CURI LAMBRAÑO,CARRERA 17 N° 26-123 CALLE NARIÑO,CALLE NARIÑO,2799470/3106949586/,181,,,ABIERTA,"(9.3096912°,-75.3984014°)"
54498000,NORTE DE SANTANDER,OCAÑA,OCAÑA,ESTATAL,MUNICIPAL,BIBLIOTECA PÚBLICA MUNICIPAL CHAID NEME,BARRIO LA PERLA,LA PERLA,5622542/3132779471/5622542,,,www.ocana-nortedesantander.gov.co,ABIERTA,"(8.2362218°,-73.3519615°)"
70221000,SUCRE,COVEÑAS,COVEÑAS,ESTATAL,MUNICIPAL,BIBLIOTECA PÚBLICA MUNICIPAL DE COVEÑAS,Detrás del transporte de Lórica,Sector la Coquerita,3002534972/3002534972/0352960238,,,www.covenas-sucre.gov.co,ABIERTA,"(9.4087400°,-75.7059500°)"
5147000,ANTIOQUIA,CAREPA,CAREPA,ESTATAL,MUNICIPAL,BIBLIOTECA PÚBLICA MUNICIPAL DE CAREPA,Cr. N° 81-20 - Casa de la Cultura, Casa de la Cultura,8236706    /    8237402/3207689705/8237402,,8236828,http://www.carepa-antioquia.gov.co,ABIERTA,"(7.7582690°,-76.6588210°)"
8078000,ATLANTICO,BARANOA,BARANOA,ESTATAL,MUNICIPAL,BIBLIOTECA PÚBLICA PEDRO GOENAGA OÑORO  ,CALLE 24 Nº 18 B-80,ESPAÑA,878 72 22/3013439948/8789163,,,http://www.baranoa-atlantico.gov.co,ABIERTA,"(10.8011500°,-74.9084100°)"
25817000,CUNDINAMARCA,TOCANCIPA,TOCANCIPÁ,ESTATAL,MUNICIPAL,BIBLIOTECA PÚBLICA ROBERTO GONZALEZ OTERO,CALLE 9 N° 9 - 80,ANTIGUA ESTACIÓN DEL TREN,8575463/3138716200/,,,http://www.tocancipa-cundinamarca.gov.co/index.sht,ABIERTA,"(4.9656110°,-73.9155970°)"
68377000,SANTANDER,LA BELLEZA,LA BELLEZA,ESTATAL,MUNICIPAL,BIBLIOTECA PÚBLICA MUNICIPAL DE LA BELLEZA,CALLE 4  CARRERA 3 ESQUINA,La Unión,3202655358/3202655358/,,,www.labelleza-santander.gov.co,ABIERTA,"(5.8567000°,-73.9667200°)"
47541000,MAGDALENA,PEDRAZA,PEDRAZA,ESTATAL,MUNICIPAL,BIBLIOTECA PÚBLICA IGNACIO OSPINO GARCIA,CARRERA 7 N° 2-36,PEDRAZA,3015741138/3205670914 /3145733473/,,,www.pedraza-magdalena.gov.co/,ABIERTA,"(10.1971300°,-74.9042660°)"
25898000,CUNDINAMARCA,ZIPACON,ZIPACÓN,ESTATAL,MUNICIPAL,BIBLIOTECA PÚBLICA MUNICIPAL DEL MUNICIPIO DE ZIPACON ,CARRERA 4 N° 4-73,CENTRO,3165269811/3194920321/,,,,ABIERTA,"(4.7592592°,-74.3803520°)"
25754000,CUNDINAMARCA,SOACHA,SOACHA,ESTATAL,MUNICIPAL,BIBLIOTECA PÚBLICA MUNICIPAL SATELITE  JOAQUÍN PIÑEROS CORPAS- SEDE CIUDAD VERDE,DIAGONAL 28 N° 29 - 26,CIUDAD VERDE,730 55 00/3208436176/,,,www.soacha-cundinamarca.gov.co,ABIERTA,"(4.5819900°,-74.2196700°)"
13442000,BOLIVAR,MARIA LA BAJA,MARÍA LA BAJA,ESTATAL,MUNICIPAL,BIBLIOTECA PÚBLICA MUNICIPAL DEL MUNICIPIO DE MARIA LA BAJA,PLAZA PRINCIPAL CALLE 20 CON CARRERA 14 ESQUINA PALACIO MUNICIPAL CENTRO,CENTRO, 6261259/3145742426/,,,www.marialabaja-bolivar.gov.co,ABIERTA,"(9.9808350°,-75.3002019°)"
66572000,RISARALDA,PUEBLO RICO,PUEBLO RICO,ESTATAL,MUNICIPAL,BIBLIOTECA PÚBLICA MUNICIPAL ABRAHAM AYALA,CARRERA 4 N° 5-58,CENTRO,3663420/3102572264/3216210579/3663420,110,3663258,bibliotecapueblorico.jimdo.com,ABIERTA,"(5.2209315°,-76.0305193°)"
20770000,CESAR,SAN MARTIN,SAN MARTÍN,ESTATAL,MUNICIPAL,BIBLIOTECA PÚBLICA ARGEMIRA PEDROZA DE ANGARITA,CALLE 18 N° 8-27,LAS ORQUIDEAS,3003477821/3108882149/,,,www.sanmartin-cesar.gov.co/,ABIERTA,"(8.0000039°,-73.5114112°)"
54743001,NORTE DE SANTANDER,SILOS,BABEGA,ESTATAL,RURAL,BIBLIOTECA PÚBLICA MUNICIPAL SATELITE DE SILOS,CORREGIMIENTO DE BABEGA,BABEGA,/3138593989/,,,www.silos-nortedesantander.gov.co,ABIERTA,"(7.1883357°,-72.7516799°)"
27245000,CHOCO,EL CARMEN DE ATRATO,EL CARMEN DE ATRATO,ESTATAL,MUNICIPAL,BIBLIOTECA PÚBLICA MUNICIPAL EL CARMEN DE ATRATO,CALLE 4 No.4-35,GUAYAQUIL,6790415/3113585546/6790415,,,http://www.elcarmendeatrato-choco.gov.co,ABIERTA,"(5.8983300°,-76.1415900°)"
5044000,ANTIOQUIA,ANZA,ANZA,ESTATAL,MUNICIPAL,BIBLIOTECA PÚBLICA MUNICIPAL LUIS MARIA LOPERA,CARRERA 54 N° 7-54,LA PUNTA,"8522082/3108952582
/",,,,ABIERTA,"(6.3026190°,-75.8536220°)"
25740000,CUNDINAMARCA,SIBATE,SIBATÉ,ESTATAL,MUNICIPAL,BIBLIOTECA PÚBLICA MUNICIPAL LA QUINTA SAMPER,CARRERA 7 N° 10-68,LA INMACULADA,7250339/3125971334/,109,7250106,www.sibate-cundinamarca.gov.co,ABIERTA,"(4.4922048°,-74.2588546°)"
8849000,ATLANTICO,USIACURI,USIACURÍ,ESTATAL,MUNICIPAL,BIBLIOTECA PÚBLICA JULIO FLÓREZ ROA,CALLE 14 N° 11-24,La Cruz,8755581/8755525  /3007780795/,,,http://www.usiacuri-atlantico.gov.co,ABIERTA,"(10.7434500°,-74.9784100°)"
68190000,SANTANDER,CIMITARRA,CIMITARRA,ESTATAL,MUNICIPAL,BIBLIOTECA PÚBLICA MUNICIPAL GILMA CASTELLANOS,CALLE 15 CARRERA 3,VILLA DEL RIO,6261523/3103125322/,,,http://www.cimitarra-santander.gov.co,ABIERTA,"(6.3184500°,-73.9516200°)"
15104000,BOYACA,BOYACA,BOYACÁ,ESTATAL,MUNICIPAL,BIBLIOTECA PÚBLICA MUNICIPAL SAN MARTÍN,CALLE 5 No 3-10,CENTRO,3124616249/3124616249/,,,,ABIERTA,"(5.4536890°,-73.3620110°)"
68522000,SANTANDER,PALMAR,PALMAR,ESTATAL,MUNICIPAL,BIBLIOTECA PÚBLICA MUNICIPAL FRANCISCO DE PAULA SANTANDER,CALLE 5 N° 3-31,CENTRO, (57+7) 8002617/3186918581/,,,www.palmar-santander.gov.co,ABIERTA,"(6.5230828°,-73.2824331°)"
15814000,BOYACA,TOCA,TOCA,ESTATAL,MUNICIPAL,BIBLIOTECA PÚBLICA MUNICIPAL DE TOCA,CALLE 3 N° 9-15,Nuevo Horizonte,7368221/3203433113 /,,,https://www.facebook.com/biblioteca.tocaboyaca,ABIERTA,"(5.5643400°,-73.1862200°)"
5059000,ANTIOQUIA,ARMENIA,ARMENIA,ESTATAL,MUNICIPAL,BIBLIOTECA PÚBLICA MUNICIPAL DEL MUNICIPIO DE ARMENIA ,CALLE 11 N° 6 - 10 ,POLIDEPORTIVO,8559020/8559015 /3207783061/,101,,,ABIERTA,"(6.1577700°,-75.7862500°)"
19110000,CAUCA,BUENOS AIRES,BUENOS AIRES,ESTATAL,MUNICIPAL,BIBLIOTECA PÚBLICA MUNICIPAL DE BUENOS AIRES GABRIEL GARCÍA MARQUEZ,CALLE PRINCIPAL ,CENTRAL,3136343853/3207566574 /3818424,0,0,http://buenosaires-cauca.gov.co,ABIERTA,"(3.0155880°,-76.6432960°)"
19392000,CAUCA,LA SIERRA,LA SIERRA,ESTATAL,MUNICIPAL,BIBLIOTECA PÚBLICA MUNICIPAL RODOLFO URRUTIA,EDIFICIO NIÑOS ESPECIALES ,BARRIO SAUCES,3148504144 /3148504144/,,,http://lasierra-cauca.gov.co/index.shtml,ABIERTA,"(2.1785187°,-76.7621016°)"
15522000,BOYACA,PANQUEBA,PANQUEBA,ESTATAL,MUNICIPAL,BIBLIOTECA PÚBLICA MUNICIPAL DEL MUNICPIO DE PANQUEBA,CARRERA 5 N° 4 -79,Centro,3107879916/3219959175/,,,,ABIERTA,"(6.4439500°,-72.4596700°)"
25386000,CUNDINAMARCA,LA MESA,LA MESA,ESTATAL,MUNICIPAL,BIBLIOTECA PÚBLICA MUNICIPAL JOSE CELESTINO MUTIS,CARRERA 19 CALLE 6  CENTRO CULTURAL LA MESA,CENTRO,8975207/ 3124311048/8975207,,8975207,www.lamesa-cundinamarca.gov.co,ABIERTA,"(4.6311736°,-74.4607096°)"
70265000,SUCRE,GUARANDA,GUARANDA,ESTATAL,MUNICIPAL,BIBLIOTECA PÚBLICA MUNICIPAL ALFREDO SIERRA VILLARREAL,CALLE 2 PLAZA PRINCIPAL,CENTRO,280 68 08/3145062554/,,,www.guaranda-sucre.gov.co,ABIERTA,"(8.4652000°,-74.5374800°)"
50251000,META,EL CASTILLO,EL CASTILLO,ESTATAL,MUNICIPAL,BIBLIOTECA PÚBLICA MUNICIPAL ALFONSO MENESES,CALLE 13 N° 8-07,SANTANDER,6540004/3204083674/,,,http://www.elcastillo-meta.gov.co/index.shtml,ABIERTA,"(3.5373751°,-73.7079513°)"
5686000,ANTIOQUIA,SANTA ROSA DE OSOS,SANTA ROSA DE OSOS,ESTATAL,MUNICIPAL,BIBLIOTECA FRANCISCO RODRÍGUEZ MOYA,CALLE 27 N° 31-12,CAMELLÓN GONZALEZ,8607310 /3022344736/8607310,,8607310,,ABIERTA,"(6.6488216°,-75.4595750°)"
5761000,ANTIOQUIA,SOPETRAN,SOPETRÁN,ESTATAL,MUNICIPAL,BIBLIOTECA PÚBLICA CARLOS MAZO,CALLE 9 N° 11-94,Calle Real,8541800/3192066664/,,,,ABIERTA,"(7.4090068°,-74.4541245°)"
70230000,SUCRE,CHALAN,CHALÁN,ESTATAL,MUNICIPAL,BIBLIOTECA PÚBLICA MUNICIPAL DE CHALAN SUCRE,CALLE REAL 6 N° 5-33,CALLE REAL,3046560274/3046560274/,,,www.chalan-sucre.gov.co,ABIERTA,"(9.5455300°,-75.3133200°)"
11001000,"BOGOTA, D.C.","BOGOTA, D.C.","BOGOTÁ, D.C.",ESTATAL,MUNICIPAL,BIBLIOTECA PÚBLICA USAQUÉN - SERVITÁ,CALLE 165 N° 7 – 52 ,Servitá,3790150/3790163/3133877086/3790150,6011,,www.biblored.gov.co,ABIERTA,"(4.7424074°,-74.0240475°)"
5212000,ANTIOQUIA,COPACABANA,COPACABANA,ESTATAL,MUNICIPAL,BIBLIOTECA PÚBLICA DEL  MUNICIPIO DE COPACABANA,CARRERA  47  N° 47A-05,SAN FRANCISCO,"2745922/2745922
/3136107444
/2745922
",,,,ABIERTA,"(6.3498235°,-75.5064394°)"
97001000,VAUPES,MITU,MITÚ,ESTATAL,MUNICIPAL,BIBLIOTECA Y CENTRO DE MEMORIA PÚBLICA MUNICIPAL,Carrera  7#7-80 , Inaya, 5642020 /3223826872/,,,,ABIERTA,"(1.2486716°,-70.2310106°)"
23350000,CORDOBA,LA APARTADA,LA APARTADA Y LA FRONTERA,ESTATAL,MUNICIPAL,BIBLIOTECA PÚBLICA MUNICIPAL JORGE LUIS COMAS LOPEZ,CALLE 19 N° 11 - 54,BARRIO MONTELIBANO,/3126449587/,,,www.laapartada-cordoba.gov.co,ABIERTA,"(8.0517930°,-75.3355715°)"
5789000,ANTIOQUIA,TAMESIS,TÁMESIS,ESTATAL,MUNICIPAL,BIBLIOTECA JOSÉ JOAQUÍN MONTOYA,CARRERA GIRALDO N° 12-68,SANTA ANA,8494745  /3116247793 /8494709,,,www.tamesis-antioquia.gov.co,ABIERTA,"(5.6635830°,-75.7133100°)"
5425000,ANTIOQUIA,MACEO,MACEO,ESTATAL,MUNICIPAL,BIBLIOTECA PÚBLICA HECTOR GÓMEZ GALLEGO,CALLE RICAURTE 30 N° 30A-18,RICAUTE,8640215 /8640288 /3127223276/8640215,,,,ABIERTA,"(6.5329817°,-74.6736858°)"
5679000,ANTIOQUIA,SANTA BARBARA,SANTA BÁRBARA,ESTATAL,MUNICIPAL,BIBLIOTECA PÚBLICA SAMUEL VELASQUEZ BOTERO,CARRERA BOLIVAR PARQUE PRINCIPAL,CARRERA BOLIVAR,8463973/3137613753 /8463973,,,,ABIERTA,"(5.8727273°,-75.5670610°)"
97161000,VAUPES,CARURU,CARURU,ESTATAL,MUNICIPAL,BIBLIOTECA PÚBLICA MUNICIPAL DE CARURU,CALLE 2 N° 4- 06 - COLEGIO PLURIETNICO DE CARURÚ,CENTRO,3102280003/3137447048/,,,,ABIERTA,"(1.0151863°,-71.2948449°)"
54245000,NORTE DE SANTANDER,EL CARMEN,EL CARMEN,ESTATAL,MUNICIPAL,BIBLIOTECA PÚBLICA MUNICIPAL MANUEL GUILLERMO GIRALDO,CENTRO PARQUE PRINCIPAL - NO HAY NOMENCLATURA,EL CENTRO,5633590/3115197461/5633484,109,,www.elcarmen-nortedesantander.gov.co,ABIERTA,"(8.5337340°,-73.4568630°)"
50686000,META,SAN JUANITO,SAN JUANITO,ESTATAL,MUNICIPAL,BIBLIOTECA PÚBLICA MUNICIPAL ERNESTO MARÍA PEÑA ROMERO,CARRERA 3 Nº 10-34,CENTRO,672 86 44/3143273148/,,,www.sanjuanito-meta.gov.co,ABIERTA,"(4.4585200°,-73.6762700°)"
76318000,VALLE DEL CAUCA,GUACARI,GUACARÍ,ESTATAL,MUNICIPAL,BIBLIOTECA PÚBLICA MUNICIPAL CARLOS FERNANDO PALAO LENNIS,CALLE 3 CON CARRERA 8-72 (ESCUELA NORMAL),BARRIO CENTRAL,2538870 / 2538547/ 3167693824/ /3128657851/2538870,0,253 08 28 ,www.guacari-valle.gov.co,ABIERTA,"(3.7660140°,-76.3334902°)"
25491000,CUNDINAMARCA,NOCAIMA,NOCAIMA,ESTATAL,MUNICIPAL,BIBLIOTECA PÚBLICA HUGO EDILBERTO RAMOS QUINTERO,CARRERA 5 N° 2-83 CASA DE LA CULTURA,LA BIENVENIDA,3208080101/3208080101/,,,,ABIERTA,"(5.0696777°,-74.3778622°)"
19473000,CAUCA,MORALES,MORALES,ESTATAL,RESGUARDO INDÍGENA,BIBLIOTECA PÚBLICA RESGUARDO INDÍGENA AGUA NEGRA,RESGUARDO INDIGENA AGUA NEGRA,I.E.I.B. AGUA NEGRA,/3167239081/,,,www.ieaguanegra.edu.co,ABIERTA,"(2.7539120°,-76.6281140°)"
5266000,ANTIOQUIA,ENVIGADO,ENVIGADO,ESTATAL,MUNICIPAL,BIBLIOTECA PÚBLICA Y CULTURAL DEBORA ARANGO,Calle 37sur 45b-27,Alcala,3394000/3117446647/3394000,4801,,www.envigado.edu.co,ABIERTA,"(6.1715238°,-75.5667950°)"
47980008,MAGDALENA,ZONA BANANERA,SEVILLA,ESTATAL,MUNICIPAL,BIBLIOTECA PÚBLICA MUNICIPAL ANIBAL REDONDO ORELLANO,PRADO SEVILLA ZONA BANANERA CASA Nº 10,PRADO SEVILLA,3135650328/3023519755/,,,www.zonabananera-magdalena.gov.co/,ABIERTA,"(10.6524300°,-74.1666400°)"
23168000,CORDOBA,CHIMA,CHIMÁ,ESTATAL,MUNICIPAL,BIBLIOTECA PÚBLICA MUNICIPAL NELO ORTIZ QUINTERO,CALLE 4 CARRERA 7 FRENTE AL PARQUE (CALLE PRINCIPAL ANTIGUO COLEGIO DE NIÑAS),CALLE CENTRAL,7679853/3005517970/,,,,ABIERTA,"(9.1492775°,-75.6317410°)"
73236000,TOLIMA,DOLORES,DOLORES,ESTATAL,MUNICIPAL,BIBLIOTECA PÚBLICA GERMAN ARCINIEGAS,CARRERA 9 - ENSEGUIDA BRIGADA MÓVIL 21 EJÉRCITO NACIONAL,OBRERO,2268131/3105543821/,,2268131,www.dolores-tolima.gov.co,ABIERTA,"(3.5359067°,-74.9008835°)"
66440000,RISARALDA,MARSELLA,MARSELLA,ESTATAL,MUNICIPAL, BIBLIOTECA PÚBLICA LEON DE GREIFF,CASA DE LA CULTURA,CENTRO,3686537/3148338919/3117974211/3686537,,,http://library.hesperian.org/Marsella,ABIERTA,"(4.9338700°,-75.7397000°)"
20001002,CESAR,VALLEDUPAR,ATANQUEZ,ESTATAL,RESGUARDO INDÍGENA,BIBLIOTECA PÚBLICA KANKUAKA,RESGUARDO INDIGENA KANKUAMO – ATANQUEZ CALLE PRINCIPAL ,ATANQUEZ,5712366/3207411027/,,,,ABIERTA,"(10.6993171°,-73.3521250°)"
5895000,ANTIOQUIA,ZARAGOZA,ZARAGOZA,ESTATAL,MUNICIPAL,BIBLIOTECA PÚBLICA MUNICIPAL DE ZARAGOZA,FINAL DE LA CALLE OLAYA HERRERA - ANTIGUO HOSPITAL.,CENTRO,8388136/3116338962/,,,,ABIERTA,"(7.4873818°,-74.8670107°)"
5001000,ANTIOQUIA,MEDELLIN,MEDELLÍN,ESTATAL,RURAL,"PARQUE BIBLIOTECA JOSÉ HORACIO BETANCUR, CORREGIMIENTO SAN ANTONIO DE PRADO",CALLE 50 E SUR N° 75a 94,El Vergel,3852972/3013907930/4194997,,,www.bibliotecasmedellin.gov.co,ABIERTA,"(6.2110709°,-75.5791785°)"
5001061,ANTIOQUIA,MEDELLIN,ORIENTE,ESTATAL,MUNICIPAL,BIBLIOTECA PÚBLICA ÁVILA,Carrera 28 A # 38 F 59,La Milagrosa,2695718/3136590910/2695718,,,http://www.bibliotecasmedellin.gov.co/,ABIERTA,"(6.2266539°,-75.5592661°)"
25324000,CUNDINAMARCA,GUATAQUI,GUATAQUÍ,ESTATAL,MUNICIPAL,BIBLIOTECA PÚBLICA MUNICIPAL DE GUATAQUI,calle 6° N° 2- 36,CENTRO,3108753048-3107769678-3223482335/3213333132/,,,http://www.guataqui-cundinamarca.gov.co/,ABIERTA,"(4.5164580°,-74.7898690°)"
18001000,CAQUETA,FLORENCIA,FLORENCIA,ESTATAL,MUNICIPAL,BIBLIOTECA PUBLICA MUNICIPAL LA GLORIA,Kilómetro 3 vía Morelia,Urbanizacion la Gloria,4348954/3127616331/3107786875/4348954,,,,ABIERTA,"(1.4873063°,-75.7256656°)"
5088000,ANTIOQUIA,BELLO,BELLO,ESTATAL,MUNICIPAL,BIBLIOTECA COMUNAL SANTA ANA,Carrera 56 N°46-03,Santa Ana,2758249/3207740990/2983555,,,https://www.facebook.com/redbibliotecasbello,ABIERTA,"(6.3391094°,-75.5556395°)"
5656000,ANTIOQUIA,SAN JERONIMO,SAN JERÓNIMO,ESTATAL,MUNICIPAL,BIBLIOTECA PÚBLICA MUNICIPAL JOAQUÍN VILLA JIMÉNEZ,CARRERA 9 # 18 -75,LA RONDA,8582249/8582024/8582283  /3146959099/,,,,ABIERTA,"(6.4424492°,-75.7262590°)"
5040000,ANTIOQUIA,ANORI,ANORÍ,ESTATAL,MUNICIPAL,BIBLIOTECA PÚBLICA LEÓN ZAFIR,CARRERA 35 N° 28B-85,PLAZA DE FERIAS,8350223  /3148496709/8350223,,,,ABIERTA,"(7.0736111°,-75.1458333°)"
68250000,SANTANDER,EL PEÑON,EL PEÑÓN,ESTATAL,MUNICIPAL,BIBLIOTECA PÚBLICA MUNICIPAL FEISAL MUSTAFA BARBOSA,SECTOR 11 DE MARZO,CASCO URBANO,/3222007947/,,,http://www.elpenon-santander.gov.co,ABIERTA,"(6.5502561°,-72.8327156°)"
25377000,CUNDINAMARCA,LA CALERA,LA CALERA,ESTATAL,RURAL,"BIBLIOTECA PUBLICA ""AMADEO RODRIGUEZ"" MARQUEZ","VEREDA MARQUEZ AL LADO DE LA ESCUELA MARQUEZ  TEATRO LA BARANDA
",SECTOR ALTAMISAR,8756622/3195050675/8756622,,8600031,http://www.lacalera-cundinamarca.gov.co/Paginas/de,ABIERTA,"(4.7988799°,-73.9913800°)"
76001012,VALLE DEL CAUCA,CALI,NAVARRO,ESTATAL,RURAL,BIBLIOTECA PÚBLICA RURAL NAVARRO,INSPECCION CORREGIMIENTO NAVARRO ,NAVARRO,3113275138/3226135342/,60,,,ABIERTA,"(3.3833600°,-76.4666500°)"
76364000,VALLE DEL CAUCA,JAMUNDI,JAMUNDÍ,ESTATAL,MUNICIPAL,BIBLIOTECA PÚBLICA MUNICIPAL ABEL ELÍ GUERRERO,Carrera 12 Nº 1 -105 Condominio los Naranjos – Barrio / El Rosario (Finca),El Rosario,5190967/3178860127/00000000,571,,,ABIERTA,"(3.2653258°,-76.5408954°)"
76497000,VALLE DEL CAUCA,OBANDO,OBANDO,ESTATAL,MUNICIPAL,BIBLIOTECA PÚBLICA MUNICIPAL JOSE MARIA OBANDO,CRA 2 No. 3 - 42,CENTRO,205 31 23/3166436292/2053123,,2053123,bibliotecajosemariaobando.blogspot,ABIERTA,"(4.5755900°,-75.9730400°)"
5088000,ANTIOQUIA,BELLO,BELLO,ESTATAL,MUNICIPAL,BIBLIOTECA COMUNAL HERMOSA PROVINCIA,TRANSVERSAL 56A NO 55-40,Barrio Hermosa Provincia,2758249/3014619368/4985529,,,https://www.facebook.com/search/top/?q=red%20de%20,ABIERTA,"(6.3423495°,-75.5618468°)"
68245000,SANTANDER,EL GUACAMAYO,EL GUACAMAYO,ESTATAL,MUNICIPAL,BIBLIOTECA PÚBLICA MUNICIPAL DOMINGO SABIO,CALLE 4 NUMERO 5- 07 ANTIGUA ESCUELA URBANA LAS COLINAS,CENTRO,3133219107/3133219107/,,,www.elguacamayo-santander.gov.co,ABIERTA,"(6.2465400°,-73.4954000°)"
76520002,VALLE DEL CAUCA,PALMIRA,AMAIME,ESTATAL,RURAL,BIBLIOTECA PÚBLICA DEL CORREGIMIENTO DE AMAIME MARIA MELBA DOMINGUEZ DE BRAND,CALLE 5 No. 13-34,Caseta comunal,3148026873/3187154052/2554396,,,https://www.palmira.gov.co/,ABIERTA,"(3.6055100°,-76.2767700°)"
8001000,ATLANTICO,BARRANQUILLA,"DISTRITO ESPECIAL, INDUSTRIAL Y PORTUARIO DE BARRANQUILLA",PRIVADA,MUNICIPAL,BIBLIOTECA LA MANGA,CARRERA 21 84-37,LA MANGA,"3643417/3046444370
/",,3643417,,ABIERTA,"(10.9707415°,-74.8245918°)"
20228002,CESAR,CURUMANI,SAN ROQUE,ESTATAL,RURAL,BIBLIOTECA PÚBLICA  CORREGIMIENTO DE SAN ROQUE,CALLE 7 CARRERA 6 ESQUINA,11 DE NOVIEMBRE,5750094/3014291954/,,,curumani-cesar.gov.co,ABIERTA,"(9.2906035°,-73.5152381°)"
91001000,AMAZONAS,LETICIA,LETICIA,ESTATAL,MUNICIPAL,BIBLIOTECA PÚBLICA MUNICIPAL DE LETICIA,"CASA DE LA CULTURA MAESTRO ALFONSO DAVILA RIBEIRO
",CENTRO URBANO,3202896123/3202896123/,,,,ABIERTA,"(-4.2031650°,-69.9359070°)"
68298000,SANTANDER,GAMBITA,GAMBITA,ESTATAL,MUNICIPAL,BIBLIOTECA PÚBLICA MUNICIPAL CRISANTO VALENZUELA Y CONDE,CARRERA 8 N° 3a-09,casa de mercado ,/3102362203/,,,www.gambita-santander.gov.co,ABIERTA,"(5.9463900°,-73.3451800°)"
5001000,ANTIOQUIA,MEDELLIN,MEDELLÍN,ESTATAL,MUNICIPAL,BIBLIOTECA PÚBLICA PILOTO FILIAL JUAN ZULETA FERRER,"CARRERA 49A N° 80-46, CAMPO VALDES",CAMPO VALDES,2118232/2122037 /3216173801/2118232,,2118232,bibliotecapiloto.gov.co,ABIERTA,"(6.2739692°,-75.5585143°)"
13673000,BOLIVAR,SANTA CATALINA,SANTA CATALINA,ESTATAL,MUNICIPAL,BIBLIOTECA PÚBLICA MUNICIPAL ROMULO BUSTOS AGUIRRE,Barrio Villa Rosita,Calle de l Cruz,3126787195/3126787195/,,,https://goo.gl/P6TfRM,ABIERTA,"(10.6027920°,-75.2878800°)"
47660000,MAGDALENA,SABANAS DE SAN ANGEL,SAN ÁNGEL,ESTATAL,MUNICIPAL,BIBLIOTECA PÚBLICA MUNICIPAL DE SABANAS DE SAN ANGEL,CALLE 3 Nº 1 A - 31,SAN NICOLAS,3205844113/3022087860/,,,www.sabanasdesanangel-magdalena.gov.co,ABIERTA,"(10.0901269°,-74.2989136°)"
73226000,TOLIMA,CUNDAY,CUNDAY,ESTATAL,MUNICIPAL,BIBLIOTECA PÚBLICA MUNICIPAL DE CUNDAY,CARRERA 8 CALLE 8 ESQUINA,INSTITUCION EDUCATIVA SAN ANTONIO,2477090/3142399280/,,,https://www.facebook.com/search/top/?init=quick&q=,ABIERTA,"(4.0608259°,-74.6941680°)"
15403000,BOYACA,LA UVITA,LA UVITA,ESTATAL,MUNICIPAL,BIBLIOTECA PÚBLICA CLAUDIA CRISTINA LOPEZ MONTAÑEZ,ENTRE LA CARRERA 2  CON CALLE 4,LOS SAUCES,7895331 /3124115497/,,,,ABIERTA,"(6.3169200°,-72.5609000°)"
5125000,ANTIOQUIA,CAICEDO,CAICEDO,ESTATAL,MUNICIPAL,BIBLIOTECA PÚBLICA MUNICIPAL SAN JUAN BOSCO,CALLE 3 N° 3 - 01,LOS GIRASOLES,8572021/3136537095/,,8572002,www.facebook.com/biblioteca.caicedo,ABIERTA,"(6.4044300°,-75.9822600°)"
76001034,VALLE DEL CAUCA,CALI,PIZAMOS,ESTATAL,MUNICIPAL,BIBLIOTECA PUBLICA MUNICIPAL  SOMOS PACIFICO,"Carrera 28B #121 B-55
", Potrero  Grande,/3155868030/,,,,ABIERTA,"(3.4205292°,-76.4854742°)"
8606000,ATLANTICO,REPELON,REPELÓN,ESTATAL,MUNICIPAL,BIBLIOTECA PÚBLICA MUNICIPAL JOSE DAVID MONCTEZUMA RECUERO,CALLE 7A N°.  6-03,PLAZA,/3126659815/,,,,ABIERTA,"(10.4935700°,-75.1194700°)"
52227008,NARIÑO,CUMBAL,TALAMBI,ESTATAL,RESGUARDO INDÍGENA,BIBLIOTECA PÚBLICA DE TALLAMBI,RESGUARDO INDÍGENA DE  MAYASQUER,TALLAMBI ,/0044450363012974/,,,,ABIERTA,"(0.8833700°,-78.0166700°)"
25781002,CUNDINAMARCA,SUTATAUSA,LAS PEÑAS,ESTATAL,RURAL,BIBLIOTECA PÚBLICA DE PEÑAS DE CAJON,ESCUELA PEÑAS DE CAJÓN,VEREDA PEÑAS DE CAJÓN,8582020/3212547557/,,,http://www.sutatausa-cundinamarca.gov.co/index.sht,ABIERTA,"(4.8071340°,-74.2194270°)"
27160000,CHOCO,CERTEGUI,CÉRTEGUI,ESTATAL,MUNICIPAL,BIBLIOTECA PÚBLICA MUNICIPAL DANIEL PALACIOS MARTINEZ,CARRERA 5 CALLE 3,BARRIO SANTANDER,/3147640231/,,,,ABIERTA,"(5.4001790°,-76.5999410°)"
13006000,BOLIVAR,ACHI,ACHÍ,ESTATAL,MUNICIPAL,BIBLIOTECA PÚBLICA DEL MUNICIPIO DE ACHI,CLL-13#15-25,Villa Yaneth,6820302/3116844859/6820302,,,www.achi-bolivar.gov.co,ABIERTA,"(8.5677180°,-74.5548110°)"
5148000,ANTIOQUIA,EL CARMEN DE VIBORAL,EL CARMEN DE VIBORAL,ESTATAL,MUNICIPAL,"BIBLIOTECA PÚBLICA MUNICIPAL ""JESUS ANTONIO ARANGO GALLO""",CALLE 34 N° 28-02,El Edén,5433355  /5433355/5433355,,,www.elcarmendeviboral-antioquia.gov.co,ABIERTA,"(6.0865937°,-75.3349839°)"
5649000,ANTIOQUIA,SAN CARLOS,SAN CARLOS,COMUNITARIA,MUNICIPAL,BIBLIOTECA PUBLICA JUAN XXIII,CARRERA 20 N° 22-09,SECTOR CASA DE LA CULTURA,8357131/3233937903/8357131,,,,ABIERTA,"(6.1877500°,-74.9928300°)"
25513000,CUNDINAMARCA,PACHO,PACHO,ESTATAL,MUNICIPAL,BIBLIOTECA PÚBLICA MUNICIPAL GUILLERMO RUIZ LARA,CALLE 10 N° 21 -60,LA PALMITA,854 09 50/3103104702/,,,https://www.facebook.com/search/top/?q=bibliored%2,ABIERTA,"(5.1346380°,-74.1598123°)"
8001000,ATLANTICO,BARRANQUILLA,"DISTRITO ESPECIAL, INDUSTRIAL Y PORTUARIO DE BARRANQUILLA",COMUNITARIA,MUNICIPAL,BIBLIOTECA POPULAR DEL BARRIO LA PAZ,CARRERA 13 N°  100 -75,LA PAZ,3481528/ 3481020 /3481528/,,,http://biblopaz.wordpress.com/,ABIERTA,"(10.9626029°,-74.8406016°)"
5490000,ANTIOQUIA,NECOCLI,NECOCLÍ,ESTATAL,MUNICIPAL,BIBLIOTECA PÚBLICA MUNICIPAL DEL MUNICIPIO DE NECOCLI,"CARRERA 51 N° 49 - 55
","CENTRO
","8214984/ 8214830/3104041272
/",,,,ABIERTA,"(8.4241710°,-76.7863660°)"
19585000,CAUCA,PURACE,COCONUCO,ESTATAL,RESGUARDO INDÍGENA,BIBLIOTECA PÚBLICA ANATOLIO QUIRA,RESGUARDO INDIGENA PURACE ,VEREDA CHAPIO,3113411440/3148919450/,,,https://www.facebook.com/profile.php?id=1000116618,ABIERTA,"(2.3419030°,-76.4960650°)"
15676000,BOYACA,SAN MIGUEL DE SEMA,SAN MIGUEL DE SEMA,ESTATAL,MUNICIPAL,BIBLIOTECA PÚBLICA MUNICIPAL HERNANDO OSPINA ANDRADE,CALLE 4 N; 3-61,EL PROGRESO,3103290129/3209124309/7347002,,7347002,,ABIERTA,"(5.5500820°,-73.7500190°)"
25815000,CUNDINAMARCA,TOCAIMA,TOCAIMA,ESTATAL,MUNICIPAL,BIBLIOTECA PÚBLICA MUNICIPAL DE TOCAIMA,CALLE 6 N° 61-50 BARRIO KENNEDY,Kennedy,/3203762900/,,,,ABIERTA,"(4.4519032°,-74.6498128°)"
15514000,BOYACA,PAEZ,PÁEZ,ESTATAL,MUNICIPAL,BIBLIOTECA PÚBLICA MUNICIPAL DE PAEZ,NO HAY NOMENCLATURA,CENTRO,3123303316/3123303316/,,,,ABIERTA,"(5.1010270°,-73.0513840°)"
13688000,BOLIVAR,SANTA ROSA DEL SUR,SANTA ROSA DEL SUR,ESTATAL,MUNICIPAL,BIBLIOTECA PÚBLICA MUNICIPAL DE SANTA ROSA DEL SUR,CARRERA 11 CON CALLE 13  JUNTO AL SALON GUARDABOSQUES,AVENIDA BETANIA.- BARRIO LAS ACACIAS,3183727464/3162739415/3125414258 ,,,https://goo.gl/qQ6fef,ABIERTA,"(7.9630810°,-74.0523580°)"
68547000,SANTANDER,PIEDECUESTA,PIEDECUESTA,ESTATAL,MUNICIPAL,BIBLIOTECA PÚBLICA MUNICIPAL ELOY VALENZUELA,CARRERA 8 N° 10-65,CENTRO,6550253/3166196133/,,,www.alcaldiadepiedecuesta.gov.co,ABIERTA,"(6.9852802°,-73.0489448°)"
15325000,BOYACA,GUAYATA,GUAYATÁ,ESTATAL,MUNICIPAL,BIBLIOTECA PÚBLICA MUNICIPAL JORGE BARRETO MORENO,CARRERA 4 N°  2-40,CENTRO,7535030 Alcaldia/3228361378/7535030,,,https://www.facebook.com/Biblioteca-municipal-Jorg,ABIERTA,"(4.9630582°,-73.4908319°)"
23670000,CORDOBA,SAN ANDRES SOTAVENTO,SAN ANDRÉS DE SOTAVENTO,ESTATAL,MUNICIPAL,BIBLIOTECA MUNICIPAL PASCUAL OROZCO MADRID,CALLE LA POPA NO.7E-2,CENTRO,3045821578/3005277876/,,,,ABIERTA,"(9.1456450°,-75.5088620°)"
25320002,CUNDINAMARCA,GUADUAS,LA PAZ DE CALAMOIMA,ESTATAL,MUNICIPAL,BIBLIOTECA PUBLICA DEL CORREGIMIENTO LA PAZ DE CALAMOIMA,CASA DE LA CULTURA DE CALAMOIMA-SIN NOMENCLATURA,CENTRO,/3125154217/,,,,ABIERTA,"(5.2167000°,-74.6333000°)"
5665000,ANTIOQUIA,SAN PEDRO DE URABA,SAN PEDRO DE URABA,ESTATAL,MUNICIPAL,BIBLIOTECA PÚBLICA MUNICIPAL CARLOS ALFREDO HURTADO LÓPEZ ,CARRERA 50 N° 52-114,EL CENTRO,8205896 / 8205503  /3126791171/,,8205503,,ABIERTA,"(8.2833333°,-76.3833333°)"
5607000,ANTIOQUIA,RETIRO,RETIRO,ESTATAL,MUNICIPAL,BIBLIOTECA PÚBLICA ROBERTO ESCOBAR ISAZA,CALLE 20 N° 23-64,CENTRO,5412260 /3005122244/5411610,,,,ABIERTA,"(6.0573830°,-75.5044415°)"
15790000,BOYACA,TASCO,TASCO,ESTATAL,MUNICIPAL,BIBLIOTECA PÚBLICA MUNICIPAL DE TASCO,TRANSVERSAL 7 N° 3 - 28,ANTONIO ARREDONDO,787 90 60/3124565233 /,103,,www.tasco-boyaca.gov.co,ABIERTA,"(5.9099320°,-72.7806900°)"
5001000,ANTIOQUIA,MEDELLIN,MEDELLÍN,ESTATAL,MUNICIPAL,BIBLIOTECA PÚBLICA CENTRO OCCIDENTAL,Calle 39D No.112-81 Interior 101,El Salado. San Javier,4928888/3016766604/5112133,103,,http://bibliotecasmedellin.gov.co/biblioteca-centr,ABIERTA,"(6.2535649°,-75.6251650°)"
5647000,ANTIOQUIA,SAN ANDRES DE CUERQUIA,SAN ANDRÉS DE CUERQUÍA,ESTATAL,MUNICIPAL,BIBLIOTECA PRESBITERO SANTIAGO LÓPEZ PALACIOS,"CARRERA 30/ NARIÑO N° 30-24CASA DE LA CULTURA ""ANDRÉS DE VALDIVIA""",NARIÑO,8618166  /3225623788/,,,,ABIERTA,"(6.9153290°,-75.6744500°)"
5030000,ANTIOQUIA,AMAGA,AMAGÁ,ESTATAL,MUNICIPAL,"BIBLIOTECA PÙBLICA  MUNICIPAL ""EMIRO KASTOS""",CARRERA 51 N° 49 - 67,CENTRAL,8470413 /3127859712/8470413,,8471197,amaga-antioquia.gov.co,ABIERTA,"(6.0398343°,-75.7040737°)"
5659000,ANTIOQUIA,SAN JUAN DE URABA,SAN JUAN DE URABÁ,ESTATAL,MUNICIPAL,"BIBLIOTECA PÚBLICA MUNICIPAL ""WATARU HAYASHI""",CARRERA 21 N° 18-59 ,CENTRO,8212582/3136109951/,,,,ABIERTA,"(8.7628200°,-76.5262200°)"
70670000,SUCRE,SAMPUES,SAMPUÉS,ESTATAL,MUNICIPAL,BIBLIOTECA  FERMINA DAZA PERDOMO,CARRERA 20 N° 25-58,CENTRO,2830707/3003805835/,,,www.sampues-sucre.gov.co,ABIERTA,"(9.1848096°,-75.3764416°)"
66001000,RISARALDA,PEREIRA,PEREIRA,ESTATAL,MUNICIPAL,BIBLIOTECA PÚBLICA MUNICIPAL RAMON CORREA MEJIA,CARRERA 10 N° 16-60 - CENTRO CULTURAL LUCY TEJADA PISO 2,CENTRO CULTURAL LUCY TEJADA,"3248733/3015627002/3117381716
/",,,,ABIERTA,"(4.8119548°,-75.6924209°)"
