73275000,TOLIMA,FLANDES,FLANDES,ESTATAL,MUNICIPAL,BIBLIOTECA PÚBLICA MUNICIPAL DE FLANDES,CARRERA 10 A. CON CALLE 5 a . ESQUINA ,LA CAPILLA,2402986/3184743353/0982469824,,,,ABIERTA,"(4.2809600°,-74.8169600°)"
73319000,TOLIMA,GUAMO,GUAMO,COMUNITARIA,MUNICIPAL,BIBLIOTECA PÚBLICA DEL GUAMO EMMA ARCINIEGAS DE MICOLTA,CALLE 8 N° 10-31,CENTRO,3158634068/3144924968/,,,,ABIERTA,"(4.0295803°,-74.9704203°)"
73347000,TOLIMA,HERVEO,HERVEO,ESTATAL,MUNICIPAL,BIBLIOTECA PÚBLICA HERMANO JUSTO RAMÓN GONZÁLEZ,CALLE 4 N° 5 - 31 PRIMER PISO,CENTRO,2539087/ 2539087/3137025326/3137025326/2539087,,,,ABIERTA,"(5.0792130°,-75.1761227°)"
73001000,TOLIMA,IBAGUE,IBAGUÉ,ESTATAL,MUNICIPAL,BIBLIOTECA ALBERTO SANTOFIMIO CAICEDO,CARRERA 9 CALLE 72 AVENIDA GUABINAL. JORDÁN VIII ETAPA,JORDAN 8 ETAPA.,2 689094/311 225 8495/2781947,,,,ABIERTA,"(4.4492923°,-75.2427139°)"
73001000,TOLIMA,IBAGUE,IBAGUÉ,ESTATAL,MUNICIPAL,BIBLIOTECA PÚBLICA VIRTUAL ALFONSO VIÑA CALDERON,"AVENIDA MIROLINDO, PARQUE DEPORTIVO",MIROLINDO,2679323/3209039646/2679323,,2679323,,ABIERTA,"(4.4306900°,-75.1863700°)"
73001000,TOLIMA,IBAGUE,IBAGUÉ,ESTATAL,MUNICIPAL,BIBLIOTECA PÚBLICA NICANOR VELASQUEZ,CALLE 125 ENTRE CRA 18D SUR Y 18B SUR CIUDADELA CONFENALCO,CIUDADELA C0MFENALCO,8 2699792/3204231387/2685287,117,,,ABIERTA,"(4.4480500°,-75.1594700°)"
73001000,TOLIMA,IBAGUE,IBAGUÉ,ESTATAL,MUNICIPAL,BIBLIOTECA CASA DE LA CULTURA EL SALADO,CARRERA 8 CALLE 146,SALADO,/3118166821/,,,,ABIERTA,"(4.4454747°,-75.1436410°)"
73001000,TOLIMA,IBAGUE,IBAGUÉ,ESTATAL,MUNICIPAL,BIBLIOTECA PÚBLICA ALVARO MUTIS,CALLE 86 CARRERA 3 SUR,CIUDADELA SIMON BOLIVAR PRIMERA ETAPA,/3163070331/2699856,,,,ABIERTA,"(4.4513549°,-75.2491289°)"
73001000,TOLIMA,IBAGUE,IBAGUÉ,ESTATAL,MUNICIPAL,BIBLIOTECA PÚBLICA GERMAN URIBE,CARRERA 4 SUR DIAGONAL 106,LA CIMA,3155235666/3118959892/,,,,ABIERTA,"(4.4458056°,-75.2416397°)"
73001000,TOLIMA,IBAGUE,IBAGUÉ,ESTATAL,MUNICIPAL,BIBLIOTECA PUBLICA JORGE ELIECER GAITAN,CARRERA 11 N° 39-100,JORGE ELIECER GAITAN,3115779407/3115779407/3115779407,,,,ABIERTA,"(4.4436318°,-75.2130353°)"
73001000,TOLIMA,IBAGUE,IBAGUÉ,ESTATAL,MUNICIPAL,BIBLIOTECA PÚBLICA CLARITA BOTERO,CALLE 15 N° 20-40 ,CLARITA BOTERO,/3143515590/2715109,,,,ABIERTA,"(4.4351954°,-75.2242185°)"
73001000,TOLIMA,IBAGUE,IBAGUÉ,ESTATAL,MUNICIPAL,BIBLIOTECA PÚBLICA GUAMBITO,CARRERA 30 SUR N° 128 - 10,DARIO HECHANDIA,/3165065147/2789600,,,,ABIERTA,"(4.4446600°,-75.2406200°)"
73001000,TOLIMA,IBAGUE,IBAGUÉ,ESTATAL,MUNICIPAL,BIBLIOTECA PÚBLICA SOLEDAD RENGIFO,CALLE 10 N°  4-55,CENTRO,2611277/3207996860/,,,,ABIERTA,"(4.4458056°,-75.2416397°)"
73001009,TOLIMA,IBAGUE,SAN BERNARDO,ESTATAL,RURAL,BIBLIOTECA PÚBLICA SAN BERNARDO,CORREGIMIENTO 12 SAN BERNARDO,SAN BERNARDO,3125560411/3125560411/,,,,ABIERTA,"(4.4955560°,-75.0744440°)"
73001010,TOLIMA,IBAGUE,SAN JUAN DE LA CHINA,ESTATAL,RURAL,BIBLIOTECA PÚBLICA SAN JUAN ,CORREGIMIENTO 12,SAN JUAN DE LA CHINA,3133467909/3133467909/,,,,ABIERTA,"(4.5401900°,-75.0768800°)"
73352000,TOLIMA,ICONONZO,ICONONZO,ESTATAL,MUNICIPAL,BIBLIOTECA PÚBLICA JOSE DEL CARMEN MORENO,CARRERA 6 N° 5-67 ICONONZO TOLIMA,CENTRO,/3123188652/,,,https://www.facebook.com/profile.php?id=1000117535,ABIERTA,"(4.1779736°,-74.5335856°)"
73408000,TOLIMA,LERIDA,LÉRIDA,ESTATAL,MUNICIPAL,BIBLIOTECA POPULAR LISÍMACO SUÁREZ REYES  ,CARRERA 12 GLORIETA CASA DE LA CULTURA,VILLA HOLANDA,/3125006930/,,,https://www.facebook.com/lisimaco.suarezreyes?fref,ABIERTA,"(4.8652500°,-74.9065500°)"
73411000,TOLIMA,LIBANO,LÍBANO,ESTATAL,MUNICIPAL,BIBLIOTECA PÚBLICA MUNICIPAL ISIDRO PARRA,CALLE 4 CARRERA 14 - 30,CENTRO,2561597/3112942003/ 3012277446/2561597,,,,ABIERTA,"(4.9257805°,-75.0680384°)"
73449000,TOLIMA,MELGAR,MELGAR,ESTATAL,MUNICIPAL,BIBLIOTECA PÚBLICA ANITA MARTINEZ DE ALFARO,CARRERA 25 N° 5-42,CENTRO,2458082 / 3144433522/3166197160/,,,,ABIERTA,"(4.2048651°,-74.6430967°)"
73461000,TOLIMA,MURILLO,MURILLO,ESTATAL,MUNICIPAL,BIBLIOTECA PÚBLICA MUNICIPAL DIEGO RIVERA ALVAREZ,CARRERA 10 NRO 3-55 CASA DE LA CULTURA,CASA CULTURA,"2532242 / 3125567494/3133403433
/2532105
",,2532242,,ABIERTA,"(4.8728036°,-75.1735598°)"
73483000,TOLIMA,NATAGAIMA,NATAGAIMA,ESTATAL,MUNICIPAL,BIBLIOTECA PÚBLICA MUNICIPAL JUAN TOLE LIS,CALLE 5 CON CARRERA 3 ESQUINA,CENTRO,3158132542/82269020/3143302050/,,,,ABIERTA,"(3.6230900°,-75.0955200°)"
73504000,TOLIMA,ORTEGA,ORTEGA,ESTATAL,MUNICIPAL,BIBLIOTECA PÚBLICA MUNICIPAL ADRIANO TAVERA,CALLE 3 N° 7,EL PRADO,2258101/3133638132/,0,,https://www.facebook.com/biblioteca.adriano.tavera,ABIERTA,"(3.9339486°,-75.2254685°)"
73520000,TOLIMA,PALOCABILDO,PALOCABILDO,ESTATAL,MUNICIPAL,BIBLIOTECA PÚBLICA JOSÉ LUIS RIVERA MILLÁN,CALLE 63 # 5-05,CENTRO,578 2529069/3144631271/2529940,,,,ABIERTA,"(5.1212800°,-75.0288940°)"
73547000,TOLIMA,PIEDRAS,PIEDRAS,ESTATAL,MUNICIPAL,BIBLIOTECA PÚBLICA MUNICIPAL TIBERIO PINZON LEON,CALLE 6 N° 4-92,CENTRO,3216341842/3183877634/,,,,ABIERTA,"(4.5424546°,-74.8805479°)"
73555000,TOLIMA,PLANADAS,PLANADAS,ESTATAL,MUNICIPAL,BIBLIOTECA PÚBLICA MUNICIPAL PLANADAS,CARRERA 4 CALLE SEXTA (ENTRADA AL MUNICIPIO),LA AVENIDA,3144822643 /3144822643/,,2265126,alcaldiaplanadas-toima.gov.co,ABIERTA,"(3.2971268°,-75.7987071°)"
73563000,TOLIMA,PRADO,PRADO,ESTATAL,MUNICIPAL,BIBLIOTECA PÚBLICA MUNICIPAL PRADO TOLIMA,calle 10 entre carrera 6 y 7. frente a la Estación de Policía,CENTRO,"2277044/3184745309
/",,,,ABIERTA,"(3.7449756°,-74.9320737°)"
73585000,TOLIMA,PURIFICACION,PURIFICACIÓN,ESTATAL,MUNICIPAL,BIBLIOTECA PÚBLICA MUNICIPAL RICARDO ALARCON GUZMÁN,CARRERA 3 N° 8-57,PLAZA DE FERIAS,228050/3153419085/3125797860,,,,ABIERTA,"(3.8623555°,-74.9256997°)"
73622000,TOLIMA,RONCESVALLES,RONCESVALLES,ESTATAL,MUNICIPAL,BIBLIOTECA PÚBLICA MUNICIPAL DEL MUNICIPIO DE RONCESVALLES,FRENTE POLIDEPORTIVO,EL CARMEN,2250038/3128955843/3114581234,,,https://www.facebook.com/profile.php?id=1000119089,ABIERTA,"(4.0101700°,-75.6039150°)"
73624000,TOLIMA,ROVIRA,ROVIRA,ESTATAL,MUNICIPAL,BIBLIOTECA PÚBLICA FELIPE SALAME,CALLE 3RA CON CRA 1ERA ESQUINA 2DO PISO CASA DE LA CULTURA,CENTRO,2880066/3212199581/,,,www.rovira-tolima.gov.co,ABIERTA,"(4.2428500°,-75.2407700°)"
73671000,TOLIMA,SALDAÑA,SALDAÑA,ESTATAL,MUNICIPAL,BIBLIOTECA PÚBLICA MUNICIPAL DEL MUNICIPIO DE SALDAÑA,CALLE 12 N° 14-33,BONANZA,2266628/3124119759/,,,www.facebook.com/bibliotecamunicipal.saldana,ABIERTA,"(3.9280449°,-75.0158949°)"
73443000,TOLIMA,SAN SEBASTIAN DE MARIQUITA,SAN SEBASTIÁN DE MARIQUITA,ESTATAL,MUNICIPAL,BIBLIOTECA PÚBLICA MUNICIPAL FRANCISCO ANTONIO MORENO Y ESCANDON,Carrera 1 enter calle2 y5,la ermita,82523274/3222954787/2523274,,,,ABIERTA,"(5.1940219°,-74.8973070°)"
73686000,TOLIMA,SANTA ISABEL,SANTA ISABEL,ESTATAL,MUNICIPAL,BIBLIOTECA PÚBLICA MUNICIPAL DE SANTA ISABEL,CARRERA 2 CALLE 8 ESQUINA SEGUNDO PISO,CENTRO,3144555153/3144555153/,,,,ABIERTA,"(4.7138291°,-75.0973156°)"
73854000,TOLIMA,VALLE DE SAN JUAN,VALLE DE SAN JUAN,ESTATAL,MUNICIPAL,BIBLIOTECA PÚBLICA MUNICIPAL JUAN LASSO DE LA VEGA,CARRERA 4 CON CALLE 6 FRENTE DE LA ALCALDIA,CENTRO,3123765395/3123765395/,,,https://www.facebook.com/profile.php?id=1000104072,ABIERTA,"(4.1979190°,-75.1174266°)"
73861000,TOLIMA,VENADILLO,VENADILLO,ESTATAL,MUNICIPAL,BIBLIOTECA GUILLERMO CASASBUENAS AYALA,CALLE 3 No. 6 - 63 , LORENZO URUEÑA,2840313/3166041098/,,,,ABIERTA,"(4.7219100°,-74.9268400°)"
73870000,TOLIMA,VILLAHERMOSA,VILLAHERMOSA,ESTATAL,MUNICIPAL,BIBLIOTECA PÚBLICA MUNICIPAL DE VILLAHERMOSA,CALLE 8 N° 4-42,Centro,3144173079 - 2533082/3213182916/,,,,ABIERTA,"(5.0302015°,-75.1169720°)"
73873000,TOLIMA,VILLARRICA,VILLARRICA,ESTATAL,MUNICIPAL,BIBLIOTECA PÚBLICA MUNICIPAL DE VILLARRICA,CARRERA 2 CALLE 2 Y 3,CENTRO,"2475503  / 2475070/3212518290
/",,,,ABIERTA,"(3.9348400°,-74.6013700°)"
76020000,VALLE DEL CAUCA,ALCALA,ALCALÁ,ESTATAL,MUNICIPAL,BIBLIOTECA PÚBLICA MUNICIPAL DE ALCALA GABRIEL GARCIA MARQUEZ,CARRERA 12 N° 6-20 (CASA DE LA CULTURA),CASA DE LA CULTURA,2003050/3127553631/,110,2004169,,ABIERTA,"(4.6751800°,-75.7843300°)"
76036000,VALLE DEL CAUCA,ANDALUCIA,ANDALUCÍA,ESTATAL,MUNICIPAL,BIBLIOTECA PÚBLICA MUNICIPAL DE ANDALUCÍA LUIS ALFONSO HERRERA MORENO,CASA DE LA CULTURA CALLE 12 N° 4-09 - PISO 1,EL CENTRO,2235205/3177348496/,113,,,ABIERTA,"(4.1697200°,-76.1697600°)"
76041000,VALLE DEL CAUCA,ANSERMANUEVO,ANSERMANUEVO,ESTATAL,MUNICIPAL,BIBLIOTECA PÚBLICA MUNICIPAL SIMÓN BOLÍVAR,CALLE 6 N° 5-28,CENTRO,2052418/3166056302/,,,,ABIERTA,"(4.7956580°,-75.9962348°)"
76054000,VALLE DEL CAUCA,ARGELIA,ARGELIA,ESTATAL,MUNICIPAL,BIBLIOTECA PÚBLICA MUNICIPAL GUILLERMO ZAPATA OSPINA,CALLE 3 N° 3-20 ,LA FLORESTA,/3137440976/,,,,ABIERTA,"(4.7244600°,-76.1174300°)"
76100000,VALLE DEL CAUCA,BOLIVAR,BOLÍVAR,ESTATAL,MUNICIPAL,BIBLIOTECA PÚBLICA ANTONIO MONDRAGON GUERRERO,CARRERA 4 N° 5-61 (CASA DE LA CULTURA),CENTRO,2224166/313 684 68 21/,113,2224166,,ABIERTA,"(4.3542422°,-76.2726130°)"
76109000,VALLE DEL CAUCA,BUENAVENTURA,"DISTRITO ESPECIAL, INDUSTRIAL, PORTUARIO, BIODIVERSO Y ECOTURÍSTICO DE BUENAVENTURA",ESTATAL,MUNICIPAL,BIBLIOTECA PÚBLICA DISTRITAL  FIDEL ORDOÑEZ SANTOS,CALLE 6 N° 11-01 AUTOP. SIMÓN BOLÍVAR,MAYOLO,2417544/ /3172975374 //2417544,,,,ABIERTA,"(3.8821575°,-77.0390906°)"
76109000,VALLE DEL CAUCA,BUENAVENTURA,"DISTRITO ESPECIAL, INDUSTRIAL, PORTUARIO, BIODIVERSO Y ECOTURÍSTICO DE BUENAVENTURA",COMUNITARIA,CONSEJO COMUNITARIO (TCCN),BIBLIOTECA PALENQUE REGIONAL EL CONGAL ,CALLE 4 N° 16 -90 BARRIO SANTA ROSA BUENAVENTURA,SANTA ROSA,2413578/3117987729/,,,,ABIERTA,"(3.8920515°,-77.0745902°)"
76122000,VALLE DEL CAUCA,CAICEDONIA,CAICEDONIA,ESTATAL,MUNICIPAL,"BIBLIOTECA PÚBLICA MUNICIPAL ""NACIANCENO OROZCO GRISALES""",CALLE 10 N° 14-46,EL CARMEN,2165188/3108270291/2165188,,,www.caicedonia-valle.gov.co,ABIERTA,"(4.3330822°,-75.8286933°)"
76001004,VALLE DEL CAUCA,CALI,EL HORMIGUERO,ESTATAL,RURAL,BIBLIOTECA PÚBLICA RURAL EL HORMIGUERO,CORREGIMIENTO DE HORMIGUERO CASA DE LA CULTURA,,3217675931 3217675931//,,,,ABIERTA,"(3.3147200°,-76.4790500°)"
76001004,VALLE DEL CAUCA,CALI,EL HORMIGUERO,ESTATAL,RURAL,BIBLIOTECA PÚBLICA RURAL CASCAJAL,CARRERA 143 Junto al parque, VEREDA CASCAJAL /URBANIZACION FLAMENCO, 311 7864620/3117864620/,,,,ABIERTA,"(3.3175100°,-76.5173300°)"
76001001,VALLE DEL CAUCA,CALI,EL SALADITO,ESTATAL,RURAL,BIBLIOTECA PÚBLICA RURAL ALVARO URIBE VELEZ,KM 14 VIA AL MAR, CORREGIMIENTO EL SALADITO,5501387/3175270480/5501387,,,,ABIERTA,"(3.4833500°,-76.6166800°)"
76001002,VALLE DEL CAUCA,CALI,FELIDIA,ESTATAL,RURAL,BIBLIOTECA PÚBLICA RURAL  FELIDIA,JUNTO A LA ESTACION DE LA POLICIA,CABECERA,/3147415888/5223186,,,,ABIERTA,"(3.4667000°,-76.6166800°)"
76001003,VALLE DEL CAUCA,CALI,GOLONDRINAS,ESTATAL,RURAL,BIBLIOTECA PÚBLICA RURAL ALEGRÍA DEL SABER,JUNTO PARROQUIA /GOLONDRINAS,SECTOR EL CENTRO,314 622 0309/3146220309/8888590,249,,,ABIERTA,"(3.5004699°,-76.5459331°)"
76001007,VALLE DEL CAUCA,CALI,LA ELVIRA,ESTATAL,RURAL,BIBLIOTECA PÚBLICA RURAL LA ELVIRA,JUNTO CASETA COMUNAL,vereda cabecera, 311 702 8574/3117028574/,,,,ABIERTA,"(3.5220580°,-76.6191317°)"
76001007,VALLE DEL CAUCA,CALI,LA ELVIRA,ESTATAL,RURAL,BIBLIOTECA PÚBLICA RURAL LUIS CARLOS GALAN SARMIENTO,CORREGIMIENTO LA ELVIRA/ VEREDA KM 18 Via al mar,ESCUELA FRANCISCO MIRANDA,3135537751/3135537751/,,,,ABIERTA,"(3.5194000°,-76.5985700°)"
76001009,VALLE DEL CAUCA,CALI,LA PAZ,ESTATAL,RURAL,BIBLIOTECA PÚBLICA RURAL LA PAZ,JUNTO A LA SEDE COMUNAL /LA PAZ,Vereda La Paz Cabecera, 311 3808906/3113808906/,,,,ABIERTA,"(3.5419800°,-76.5877600°)"
76001010,VALLE DEL CAUCA,CALI,LOS ANDES,ESTATAL,RURAL,BIBLIOTECA PÚBLICA RURAL LOS ANDES,JUNTO CASETA COMUNAL,"CORREGIMIENTO LOS ANDES, VEREDA LOS ANDES, CABECER",3163258096/3163258096/,,,,ABIERTA,"(3.4714644°,-76.4982375°)"
76001016,VALLE DEL CAUCA,CALI,MONTEBELLO,ESTATAL,RURAL,BIBLIOTECA PÚBLICA RURAL RUMENIGUE PEREA PADILLA,CALLE 11 OESTE 42-12 / MONTEBELLO,MONTEBELLO,8888739 321 7311213/3217311213/,,,,ABIERTA,"(3.4858400°,-76.5449500°)"
76001014,VALLE DEL CAUCA,CALI,PICHINDE,ESTATAL,RURAL,BIBLIOTECA PÚBLICA RURAL JAN BARTELSMAN,SEDE COMUNAL PICHINDÉ,CORREGIMIENTO PICHINDE,300 358 9400/300 358 9400/,,,,ABIERTA,"(3.4636909°,-76.5876160°)"
76001000,VALLE DEL CAUCA,CALI,SANTIAGO DE CALI,ESTATAL,MUNICIPAL,BIBLIOTECA PÚBLICA MUNICIPAL  EL RETIRO,CARRERA 39B N° 48A-01  ,EL RETIRO,4278036/3136287522/3386791,,,,ABIERTA,"(3.4108089°,-76.5010726°)"
76001000,VALLE DEL CAUCA,CALI,SANTIAGO DE CALI,ESTATAL,MUNICIPAL,BIBLIOTECA PÚBLICA  FRANCISCO J. RUIZ,Calle 39A N° 43A- 22,REPÚBLICA DE ISARAEL.,3381752/3207226416/3012601625/3381752,,,,ABIERTA,"(3.4190282°,-76.5164283°)"
76001000,VALLE DEL CAUCA,CALI,SANTIAGO DE CALI,ESTATAL,RURAL,BIBLIOTECA PÚBLICA RURAL LA BUITRERA,KM 3 cerca al puesto de policía ,Corregimiento la buitrera - sector el plan ,/3182489867/,,,,ABIERTA,"(3.3829662°,-76.5863882°)"
76001000,VALLE DEL CAUCA,CALI,SANTIAGO DE CALI,ESTATAL,RURAL,BIBLIOTECA PÚBLICA RURAL LA CASTELLANA ,PARQUE PRINCIPAL DE PUEBLO PANCE JUNTO A LA PARROQUIA,PUEBLO PANCE,5584630/3158454346/5584630,,,,ABIERTA,"(3.3283400°,-76.6386500°)"
76001000,VALLE DEL CAUCA,CALI,SANTIAGO DE CALI,ESTATAL,MUNICIPAL,BIBLIOTECA PÚBLICA MUNICIPAL CENTRO CULTURAL NUEVO LATIR,CALLE 76 N° 28 - 20,ALFONSO BONILLA ARAGÒN,4140777/3196773528/3196773528/4870553,3010,,www.cali.gov.co/redbibliotecas,ABIERTA,"(3.4750007°,-76.4813307°)"
76001000,VALLE DEL CAUCA,CALI,SANTIAGO DE CALI,ESTATAL,MUNICIPAL,BIBLIOTECA PÚBLICA MUNICIPAL DEL DEPORTE Y LA RECREACIÓN,Cra 34  Calle 5b  Lado oriental Estadio Pascual Guerrero,SAN FERNANDO,3163942170/3163942170/,,,https://www.facebook.com/bibliodeporte/?fref=ts,ABIERTA,"(3.4223673°,-76.5290185°)"
76001000,VALLE DEL CAUCA,CALI,SANTIAGO DE CALI,ESTATAL,MUNICIPAL,BIBLIOTECA PÚBLICA CENTRO CULTURAL COMUNA 18,Calle 1B Oeste N° 93-24,ALTO JORDAN,3324994/3157559330/3324994,,,,ABIERTA,"(3.4526473°,-76.5418054°)"
76001000,VALLE DEL CAUCA,CALI,SANTIAGO DE CALI,ESTATAL,MUNICIPAL,BIBLIOTECA PÚBLICA MUNICIPAL CENTRO  DE  EMPRENDIMIENTO CULTURAL COMUNA 13,CARRERA 28D N° 70-91,BARRIO EL PONDAJE,4480004/3017355513/4480004,,4480019,WWW.CALI.GOV.CO,ABIERTA,"(3.4339391°,-76.4950974°)"
76001000,VALLE DEL CAUCA,CALI,SANTIAGO DE CALI,ESTATAL,MUNICIPAL,BIBLIOTECA PÚBLICA MUNICIPAL  DESEPAZ,CARRERA 23 N° 120-00,DESEPAZ,/3155949248/,,,,ABIERTA,"(3.4252966°,-76.5523166°)"
76001000,VALLE DEL CAUCA,CALI,SANTIAGO DE CALI,ESTATAL,MUNICIPAL,BIBLIOTECA PÚBLICA MUNICIPAL ALTO POLVORINES,Calle 3C Oeste N° 94-2-84,ALTO POLVORINES,3102878/3186859637/3186859637/,,,,ABIERTA,"(3.4451858°,-76.5531738°)"
76001000,VALLE DEL CAUCA,CALI,SANTIAGO DE CALI,ESTATAL,MUNICIPAL,BIBLIOTECA PÚBLICA MUNICIPAL ANTONIO JOSÉ ESCOBAR,Calle 54 N° 15 A - 24 Escuela cacique Guatavita ,CHAPINERO,438 1995/3006679793/4381995,,,,ABIERTA,"(3.4427973°,-76.4983327°)"
76001000,VALLE DEL CAUCA,CALI,SANTIAGO DE CALI,ESTATAL,MUNICIPAL,BIBLIOTECA PÚBLICA MUNICIPAL LA CAMPIÑA,Av. 7 Norte N° 42N - 07,La Campiña,8858855/3163208606/3754640,,,,ABIERTA,"(3.4710925°,-76.5310503°)"
76001000,VALLE DEL CAUCA,CALI,SANTIAGO DE CALI,ESTATAL,MUNICIPAL,BIBLIOTECA PÚBLICA MUNICIPAL DEL CENTENARIO,Av. Colombia Calle 4 Oeste - Esquina,EL PEÑÓN,893 2908/3177489196/8932908,,,,ABIERTA,"(3.4538300°,-76.5513600°)"
76001000,VALLE DEL CAUCA,CALI,SANTIAGO DE CALI,ESTATAL,DEPARTAMENTAL,BIBLIOTECA DEPARTAMENTAL JORGE GARCES BORRERO,CALLE 5 N° 24A - 91, BARRIO SAN FERNANDO,6200400/6200403/3003258688/,,,http://www.bibliovalle.gov.co/,ABIERTA,"(3.4373414°,-76.5391976°)"
76001000,VALLE DEL CAUCA,CALI,SANTIAGO DE CALI,ESTATAL,MUNICIPAL,BIBLIOTECA PÚBLICA MUNICIPAL FUNDAUTÓNOMA,CARRERA 28-3  N° 72Y-09,EL POBLADO II,4268795/3146519864/8802762,,,,ABIERTA,"(3.4218451°,-76.4880312°)"
76001000,VALLE DEL CAUCA,CALI,SANTIAGO DE CALI,ESTATAL,MUNICIPAL,BIBLIOTECA PÚBLICA MUNICIPAL CENTRO CULTURAL COMUNA 20,CARRERA 54 OESTE 10-28,BRISAS DE MAYO,5535160/3136775908/,,,,ABIERTA,"(3.4164298°,-76.5632049°)"
76001000,VALLE DEL CAUCA,CALI,SANTIAGO DE CALI,ESTATAL,MUNICIPAL,BIBLIOTECA PÚBLICA MUNICIPAL ÁLVARO MUTIS,CALLE 50 CARRERA  28 f 131 F,DOCE DE OCTUBRE,3177949099/3177949099/,,,,ABIERTA,"(3.4302430°,-76.4983883°)"
76001000,VALLE DEL CAUCA,CALI,SANTIAGO DE CALI,ESTATAL,MUNICIPAL,BIBLIOTECA PÚBLICA MUNICIPAL ARCO IRIS,CALLE  85A N° 28 E6-102    ,MOJICA II,3167236403/3167236403/3795953,,,,ABIERTA,"(3.4838105°,-76.5233498°)"
76001000,VALLE DEL CAUCA,CALI,SANTIAGO DE CALI,ESTATAL,MUNICIPAL,BIBLIOTECA PÚBLICA MUNICIPAL TIERRA BLANCA,Calle 7B Oeste N° 48A-29 Sede Comunal ,TIERRA BLANCA,552 9844/3128168270/5529844,,,,ABIERTA,"(3.4447337°,-76.5532923°)"
76001000,VALLE DEL CAUCA,CALI,SANTIAGO DE CALI,ESTATAL,MUNICIPAL,BIBLIOTECA PÚBLICA MUNICIPAL EL DORADO,CALLE 13C N° 36A-31,EL DORADO,3044582399/3044582399/,,,,ABIERTA,"(3.4213251°,-76.5281654°)"
76001000,VALLE DEL CAUCA,CALI,SANTIAGO DE CALI,ESTATAL,MUNICIPAL,BIBLIOTECA PÚBLICA MUNICIPAL ISABEL ALLENDE,Carrera 7P Calle 74 esquina,ALFONSO LÓPEZ 3 ETAPA,6630400 / 316 2585417/3162585417/3815512,,,,ABIERTA,"(3.4572448°,-76.5094584°)"
76001000,VALLE DEL CAUCA,CALI,SANTIAGO DE CALI,ESTATAL,MUNICIPAL,BIBLIOTECA PÚBLICA MUNICIPAL GABO,CALLE 40  N°  46C-40,MARIANO RAMOS,3273739/3188075999/,,,,ABIERTA,"(3.4071932°,-76.5164952°)"
76001000,VALLE DEL CAUCA,CALI,SANTIAGO DE CALI,ESTATAL,MUNICIPAL,BIBLIOTECA PÚBLICA MUNICIPAL ISAÍAS GAMBOA,CALLE 32 AN N° 3N-05 SEDE COMUNAL,SULTANA BERLÍN,448 6074 / 3122674097/3122674097/4486074,,,,ABIERTA,"(3.4672608°,-76.5190683°)"
76001000,VALLE DEL CAUCA,CALI,SANTIAGO DE CALI,ESTATAL,MUNICIPAL,BIBLIOTECA PÚBLICA MUNICIPAL JOSÉ MARTÍ,Calle 67 con carrera 6N esquina,Calima,439 9059 /3218728225/4467356,,,,CERRADA,"(3.4783757°,-76.5072741°)"
76001000,VALLE DEL CAUCA,CALI,SANTIAGO DE CALI,ESTATAL,MUNICIPAL,BIBLIOTECA PÚBLICA MUNICIPAL LA MARIA,CARRERA 5 N°  2-69 ESCUELA A. SARDI,B/ SAN ANTONIO,893 6885/3206280485/3206280485,,,,ABIERTA,"(3.4480530°,-76.5393537°)"
76001000,VALLE DEL CAUCA,CALI,SANTIAGO DE CALI,ESTATAL,MUNICIPAL,BIBLIOTECA PÚBLICA MUNICIPAL RIGOBERTA MENCHU,CARRERA 32A N° 49-50  SEDE COMUNAL 2 PISO,LAUREANO GÓMEZ,3148824260/3148824260/4017923,,,,ABIERTA,"(3.4138618°,-76.4963755°)"
76001000,VALLE DEL CAUCA,CALI,SANTIAGO DE CALI,ESTATAL,MUNICIPAL,BIBLIOTECA PÚBLICA MUNICIPAL SAN LUIS I,Calle 71 N°  1A 10 - 50 ,SAN LUIS 1,8888555/3162725162/,,,https://www.facebook.com/people/Biblioteca-San-Lui,ABIERTA,"(3.4495927°,-76.4870490°)"
76001000,VALLE DEL CAUCA,CALI,SANTIAGO DE CALI,ESTATAL,MUNICIPAL,BIBLIOTECA PÚBLICA MUNICIPAL SENA,Carrera 3 N° 46C - 10 ,EL SENA,4291276/3187767860/3357145,,,,ABIERTA,"(3.4642035°,-76.5044313°)"
76001000,VALLE DEL CAUCA,CALI,SANTIAGO DE CALI,ESTATAL,MUNICIPAL,BIBLIOTECA PÚBLICA MUNICIPAL LA GUACA,CALLE 14 OESTE N° 5-180,Bellavista,3183891510/3183891510/5578358,,,,ABIERTA,"(3.4547471°,-76.5312940°)"
76001000,VALLE DEL CAUCA,CALI,SANTIAGO DE CALI,ESTATAL,MUNICIPAL,BIBLIOTECA PÚBLICA MUNICIPAL LEÓN DE GREIFF,CALLE 72B N° 11-06,SIETE DE AGOSTO,6561923/316 8640838/6561923,,,,ABIERTA,"(3.4482586°,-76.4850803°)"
76001000,VALLE DEL CAUCA,CALI,SANTIAGO DE CALI,ESTATAL,MUNICIPAL,BIBLIOTECA PÚBLICA MUNICIPAL VILLALUZ,Calle 106 N° 28D - 02  ,BARRIO VILLALUZ, /3006764984/,,,,ABIERTA,"(3.4145605°,-76.4793814°)"
76001000,VALLE DEL CAUCA,CALI,SANTIAGO DE CALI,ESTATAL,MUNICIPAL,BIBLIOTECA PÚBLICA MUNICIPAL CENTRAL DIDÁCTICA EL POBLADO,CARRERA 28F N°  72L-79   ,BARRIO EL POBLADO ,5542949/3184768021/6633113,27405,,,ABIERTA,"(3.4179806°,-76.4938182°)"
76001000,VALLE DEL CAUCA,CALI,SANTIAGO DE CALI,ESTATAL,MUNICIPAL,BIBLIOTECA PÚBLICA MUNICIPAL CENTRAL DIDÁCTICA EL VALLADO,CALLE 48 N° 41C-49  , EL VALLADO,5542949/3216469631/4005632,27436,,,ABIERTA,"(3.4085163°,-76.5036998°)"
76001000,VALLE DEL CAUCA,CALI,SANTIAGO DE CALI,ESTATAL,MUNICIPAL,BIBLIOTECA PÚBLICA MUNICIPAL CENTRAL DIDÁCTICA LA CASONA,CARRERA 27 N°  103 - 71,ALFONSO BONILLA  ARAGÓN,5542949 /3164378187/4361943,27473,,https://www.facebook.com/centraldidactica.casona,ABIERTA,"(3.4176064°,-76.4781191°)"
76001000,VALLE DEL CAUCA,CALI,SANTIAGO DE CALI,ESTATAL,MUNICIPAL,BIBLIOTECA PÚBLICA MUNICIPAL EL JARDÍN,CALLE 27 N° 36-10,EL JARDIN,/3015462995/,,,,ABIERTA,"(3.4207397°,-76.5173298°)"
76001000,VALLE DEL CAUCA,CALI,SANTIAGO DE CALI,ESTATAL,MUNICIPAL,CENTRO CULTURAL DE CALI,CARRERA 5 N° 6-05,LA MERCED,8858855/3167574549/8858852112,112,,,ABIERTA,"(3.4547681°,-76.5255730°)"
76001000,VALLE DEL CAUCA,CALI,SANTIAGO DE CALI,ESTATAL,MUNICIPAL,BIBLIOTECA PÚBLICA MUNICIPAL CENTRO CULTURAL COMUNA 1,AVENIDA 5 A OESTE 44-69,VISTA HERMOSA,894 4801/3164294173/8944801,,,,ABIERTA,"(3.4605537°,-76.5295829°)"
76001000,VALLE DEL CAUCA,CALI,SANTIAGO DE CALI,ESTATAL,MUNICIPAL,BIBLIOTECA PÚBLICA MUNICIPAL LAS ACACIAS,CARRERA 24 B N° 19A-14,LAS ACACIAS,3006518490/3044336794/,,,,ABIERTA,"(3.4371409°,-76.5061048°)"
76001000,VALLE DEL CAUCA,CALI,SANTIAGO DE CALI,ESTATAL,MUNICIPAL,BIBLIOTECA PÚBLICA MUNICIPAL SAN NICOLÁS,Calle 20 N° 5-63 (Frente al parque),B/SAN NICOLÁS (AL FRENTE DEL PARQUE),889 1860/3159274485/,,,,ABIERTA,"(3.4543717°,-76.5254865°)"
76001000,VALLE DEL CAUCA,CALI,SANTIAGO DE CALI,ESTATAL,MUNICIPAL,BIBLIOTECA PÚBLICA MUNICIPAL SAN PEDRO ,DIAGONAL  32 N° 30-33 ,SAN PEDRO CLAVER,3348198/3128527399/,,,,ABIERTA,"(3.4279057°,-76.5401308°)"
76126000,VALLE DEL CAUCA,CALIMA,DARIÉN,ESTATAL,MUNICIPAL,BIBLIOTECA PÚBLICA MUNICIPAL DEL DARIEN,CRA 9 CON CLL 11 ESQUINA,SAN VICENTE,2534563/3153746786/2534563,,,,ABIERTA,"(3.9311105°,-76.4837808°)"
76130000,VALLE DEL CAUCA,CANDELARIA,CANDELARIA,ESTATAL,MUNICIPAL,BIBLIOTECA PÚBLICA MUNICIPAL DE CANDELARIA,Calle 10° con Carrera 7° esquina,LA CRUZ - DIAGONAL A LA IGLESIA NESTRA SEÑORA DE L,2648338/3105286605/2600968,120,,,ABIERTA,"(3.4058524°,-76.3484719°)"
76130000,VALLE DEL CAUCA,CANDELARIA,CANDELARIA,ESTATAL,MUNICIPAL,BIBLIOTECA PÚBLICA DEL CORREGIMIENTO DE VILLAGORGONA,Cra 16 con  Calle 12 Esquina ,Juan Pablo - Villagorgona,/3163391080/,,2647856,candelaria-valle.gov.co,ABIERTA,"(3.4603902°,-76.5181875°)"
76892000,VALLE DEL CAUCA,YUMBO,YUMBO,ESTATAL,MUNICIPAL,BIBLIOTECA PÚBLICA MUNICIPAL DE YUMBO,CARRERA 4 N° 5-27,BELALCÁZAR,3136198761/3126603094/,,,www.imcy.gov.co,ABIERTA,"(3.5838921°,-76.4953622°)"
76130004,VALLE DEL CAUCA,CANDELARIA,EL CARMELO,ESTATAL,MUNICIPAL,BIBLIOTECA PÚBLICA MUNICIPAL DEL CORREGIMIENTO EL CARMELO,Cra 12 No. 12-18,El jardin - Corregimiento El Carmelo,/3193067957/,,2647856,candelaria-valle.gov.co,ABIERTA,"(3.4118301°,-76.3503729°)"
76147000,VALLE DEL CAUCA,CARTAGO,CARTAGO,ESTATAL,MUNICIPAL,BIBLIOTECA PÚBLICA MARCO FIDEL SUAREZ,CALLE 10 N° 3-46,CENTRO,3127452481/3162368255/3186699236/0,0,0,,ABIERTA,"(4.7508963°,-75.9116409°)"
76243000,VALLE DEL CAUCA,EL AGUILA,EL ÁGUILA,ESTATAL,MUNICIPAL,BIBLIOTECA PÚBLICA MUNICIPAL FRANCISCO VELASQUEZ DE EL AGUILA,CARRERA 3 N° 8-24 (CASA DE LA CULTURA),CENTRO,3128512763/3147649036/,,,,ABIERTA,"(4.9087000°,-76.0428000°)"
76246000,VALLE DEL CAUCA,EL CAIRO,EL CAIRO,ESTATAL,MUNICIPAL,BIBLIOTECA PÚBLICA MUNICIPAL EL CAIRO VALLE,Calle 9 con Carrera 5 Esquina Alcaldía Municipal,CENTRO,207 72 68/3187426953/,,,WWW.ELCAIRO.GOV.CO,ABIERTA,"(4.7616500°,-76.2190700°)"
76248000,VALLE DEL CAUCA,EL CERRITO,EL CERRITO,ESTATAL,MUNICIPAL,BIBLIOTECA PÚBLICA MUNICIPAL DEL MUNICIPIO EL CERRITO,ANTIGUAS BODEGAS DEL FERROCARRIL (ANTIGUA ESTACIÓN ),SANTA BARBARA,2565244/3184837650/3104383947/,,2577151,,ABIERTA,"(3.6666667°,-76.1666667°)"
76250000,VALLE DEL CAUCA,EL DOVIO,EL DOVIO,ESTATAL,MUNICIPAL,BIBLIOTECA PÚBLICA MUNICIPAL DUVARDO PIEDRAHITA CARDONA,CALLE 15 CASA COMUNITARIA,PROVIVIENDA,/3113708745/,,,,ABIERTA,"(4.5050200°,-76.2358700°)"
76275000,VALLE DEL CAUCA,FLORIDA,FLORIDA,ESTATAL,MUNICIPAL,BIBLIOTECA PÚBLICA MUNICIPAL FELIX RAFFAN GOMEZ,CALLE 7 A No. 19-30 /PARA ENVÍOS COMO MENSAJERÍA SE PUEDEN HACER ENTREGAS EN LA CALLE 9 CRA 21,EL PROGRESO,/3206361966/2641104,,,,ABIERTA,"(3.3256400°,-76.2373500°)"
76111000,VALLE DEL CAUCA,GUADALAJARA DE BUGA,GUADALAJARA DE BUGA,ESTATAL,MUNICIPAL,"BIBLIOTECA PÚBLICA MUNICIPAL ""CARLOS HUMBERTO MORALES""",CALLE 16 N° 14-50,DIVINO NIÑO,237 55 59/3174588671/2392284,,,,ABIERTA,"(3.9082464°,-76.2987065°)"
76400000,VALLE DEL CAUCA,LA UNION,LA UNIÓN,ESTATAL,MUNICIPAL,BIBLIOTECA PÚBLICA MUNICIPAL AGUSTÍN ANTONIO SARRIA GONZALEZ,CARRERA 10 N° 14-38 (CASA DE LA CULTURA),LAS LAJAS ,2293620/3148115362/2293620,,,,ABIERTA,"(3.2584300°,-76.2290700°)"
76520032,VALLE DEL CAUCA,PALMIRA,LA BUITRERA,ESTATAL,RURAL,BIBLIOTECA PÚBLICA LIDA CARVAJAL ZAFRA DEL CORREGIMIENTO DE LA BUITRERA,CALLE 10 N°  11-05 CORREGIMIENTO LA BUITRERA,LA BUITRERA,3164439152/3164439152/,,,,ABIERTA,"(3.4875274°,-76.2144675°)"
76563000,VALLE DEL CAUCA,PRADERA,PRADERA,ESTATAL,MUNICIPAL,BIBLIOTECA PÚBLICA MUNICIPAL DE PRADERA,CALLE 11 CON CARRERA 7 ESQUINA - BARRIO LA MARÍA,LA MARIA,2670558/3146230487/,,,,ABIERTA,"(3.4145500°,-76.2423700°)"
76606000,VALLE DEL CAUCA,RESTREPO,RESTREPO,ESTATAL,MUNICIPAL,"BIBLIOTECA PÚBLICA MUNICIPAL ""DARIO BETANCOURTH ECHEVERRY""",CARRERA 11 CALLE 12 ESQUINA,CENTRO,2521198/3146537383/2521196,,,,ABIERTA,"(3.8182882°,-76.5238273°)"
76616002,VALLE DEL CAUCA,RIOFRIO,FENICIA,ESTATAL,RURAL,BIBLIOTECA PÚBLICA ANTONIO NARIÑO,CALLE 7 N° 2 - 50,CENTRO,3146641455/3146641455/,,,,ABIERTA,"(4.0808200°,-76.3708600°)"
76616007,VALLE DEL CAUCA,RIOFRIO,PORTUGAL DE PIEDRAS,ESTATAL,RURAL,BIBLIOTECA PÚBLICA FRANCISCO DE PAULA SANTANDER,CALLE PRINCIPAL ENSEGUIDA PUESTO DE SALUD,CALLE PRINCIPAL,3207503898/3207503898/,,,,ABIERTA,"(4.0625800°,-76.3342300°)"
76616000,VALLE DEL CAUCA,RIOFRIO,RIOFRÍO,ESTATAL,MUNICIPAL,BIBLIOTECA PÚBLICA MUNICIPAL MARCO FIDEL SUAREZ,CARRERA 9 N° 4-35 (CASA DE LA CULTURA),CENTRO,2268427/3216968857/,,,,ABIERTA,"(4.2055241°,-76.3226665°)"
76616009,VALLE DEL CAUCA,RIOFRIO,SALÓNICA,ESTATAL,RURAL,BIBLIOTECA PÚBLICA JOSE ROQUE GIL,CARRERA 3 DIAGONAL AL ALMACEN EL PAISA BARATON,PARQUE SALONICA,3166417275/3166417275/,,,,ABIERTA,"(4.1267400°,-76.3705200°)"
