25489000,CUNDINAMARCA,NIMAIMA,NIMAIMA,ESTATAL,MUNICIPAL,BIBLIOTECA PÚBLICA MUNICIPAL DE NIMAIMA,CALLE 3 N° 3-11,CENTRO,8433082/3108753103/,,,,ABIERTA,"(5.1259015°,-74.3853324°)"
25489001,CUNDINAMARCA,NIMAIMA,TOBIA,ESTATAL,RURAL,BIBLIOTECA PÚBLICA MUNICIPAL DE NIMAIMA TOBIA,CLL 3 # 2 - 10 CENTRO,CENTRO,3124502529/3124502529/,,,,ABIERTA,"(5.1216990°,-74.4487880°)"
25513000,CUNDINAMARCA,PACHO,PACHO,ESTATAL,MUNICIPAL,BIBLIOTECA PÚBLICA INFANTIL ISABEL BUNCH,CARRERA 27 N° 6-21,LA CRINOLINA,0000000/3045522212/,,,,ABIERTA,"(5.1396287°,-74.1578440°)"
25524000,CUNDINAMARCA,PANDI,PANDI,ESTATAL,MUNICIPAL,BIBLIOTECA PÚBLICA MUNICIPAL DE PANDI,CARRERA 4  N° 3-55,CENTRO,/3115633325/,,,,ABIERTA,"(4.1911756°,-74.4873800°)"
25535000,CUNDINAMARCA,PASCA,PASCA,ESTATAL,MUNICIPAL,BIBLIOTECA PÚBLICA MUNICIPAL ADOLFO LEÓN GÓMEZ,CASA DE LA CULTURA DE PASCA ENTRADA AV EL PROGRESO,AVENIDA EL PROGRESO,8688009/3138333311/,20,8688086,,ABIERTA,"(4.3072220°,-74.3005560°)"
25580000,CUNDINAMARCA,PULI,PULÍ,ESTATAL,MUNICIPAL,BIBLIOTECA PÚBLICA MUNICIPAL DE PULI,CALLE 3 N° 3-07,CENTRO,3133579823/3195079381/0,,,,ABIERTA,"(4.6804502°,-74.7136436°)"
25592000,CUNDINAMARCA,QUEBRADANEGRA,QUEBRADANEGRA,ESTATAL,MUNICIPAL,BIBLIOTECA PÚBLICA MUNICIPAL DE QUEBRADANEGRA,CALLE 4 N° 3 - 04,Centro,3133812780/3133812780/0000000,,,,ABIERTA,"(5.1175232°,-74.4790914°)"
25594000,CUNDINAMARCA,QUETAME,QUETAME,ESTATAL,MUNICIPAL,BIBLIOTECA PÚBLICA MUNICIPAL JOSÉ DAVID GUARÍN,CARRERA 3 CON CALLE 2 ESQUINA CASA DE LA CULTURA ,CENTRO,00000/3202165177/,,,,ABIERTA,"(4.3307930°,-73.8630865°)"
25596000,CUNDINAMARCA,QUIPILE,QUIPILE,ESTATAL,MUNICIPAL,BIBLIOTECA PÚBLICA DEL MUNICIPIO DE QUIPILE,AVENIDA 2 N° 2-36,CENTRO,091-8499000 / 8479012/3193079928/,,,,ABIERTA,"(4.7451981°,-74.5340189°)"
25612000,CUNDINAMARCA,RICAURTE,RICAURTE,ESTATAL,MUNICIPAL,BIBLIOTECA PÚBLICA MUNICIPAL DE RICAURTE,CARRERA 7 N° 10-68,CENTRO,3202684863/3105873490/,,,,ABIERTA,"(4.2779090°,-74.7726360°)"
25645000,CUNDINAMARCA,SAN ANTONIO DEL TEQUENDAMA,SAN ANTONIO DEL TEQUENDAMA,ESTATAL,MUNICIPAL,BIBLIOTECA PÚBLICA MUNICIPAL DE SAN ANTONIO DEL TEQUENDAMA,CARRERA 6a N° 6 - 37/39 POLIDEPORTIVO MUNICIPAL SAN ANTONIO DEL TEQUEDAMA,SAN ANTONIO DEL TEQUENDAMA CENTRO,/3013251117/,,,,ABIERTA,"(4.6163800°,-74.3523400°)"
25649000,CUNDINAMARCA,SAN BERNARDO,SAN BERNARDO,ESTATAL,MUNICIPAL,BIBLIOTECA PÚBLICA FELIX ANTONIO ROA MENDOZA,CARRERA 4 N° 7-41 CASA DE LA CULTURA PISO 2,SAN GABRIEL,/3204298388/8680708,,,,ABIERTA,"(4.1785710°,-74.4242019°)"
25653000,CUNDINAMARCA,SAN CAYETANO,PUEBLO NUEVO,ESTATAL,MUNICIPAL,BIBLIOTECA PÚBLICA MUNICIPAL SAN CAYETANO,VIA PRINCIPAL - INSTITUCION EDUCATIVA DEPARTAMENTAL INTEGRADO SAN CAYETANO,CASCO URBANO,3223668628 /3223668628/3106192081,,,,ABIERTA,"(5.3041700°,-74.0731000°)"
25658000,CUNDINAMARCA,SAN FRANCISCO,SAN FRANCISCO,ESTATAL,MUNICIPAL,BIBLIOTECA PÚBLICA MUNICIPAL EDUARDO PALACIOS,CALLE 3 CARRERA 6 ESQUINA,CENTRO,/3005302208/,,,http://www.sanfrancisco-cundinamarca.gov.co/quiene,ABIERTA,"(4.9735933°,-74.2896317°)"
25662000,CUNDINAMARCA,SAN JUAN DE RIO SECO,SAN JUAN DE RÍO SECO,ESTATAL,MUNICIPAL,BIBLIOTECA PÚBLICA MUNICIPAL DE SAN JUAN DE RIOSECO,INSTITUCIÓN EDUCATIVA DEPARTAMENTAL SAN JUAN DE RIO SECO,BARRIO PUEBLO NUEVO,8465052/3112432659/3143697812/,,,,ABIERTA,"(4.8678800°,-74.5804136°)"
25718000,CUNDINAMARCA,SASAIMA,SASAIMA,ESTATAL,MUNICIPAL,BIBLIOTECA PÚBLICA MUNICIPAL USSURBANIPAL,CARRERA 4 N° 8-58,CENTRO,8468022/3222337379/,,,,ABIERTA,"(4.9632957°,-74.4344122°)"
25736000,CUNDINAMARCA,SESQUILE,SESQUILÉ,ESTATAL,MUNICIPAL,BIBLIOTECA PÚBLICA MUNICIPAL DE SESQUILÉ,CALLE 5 N°. 7-15 ,CENTRO,3202597918/3202597918/3202597918,,,,ABIERTA,"(5.0466146°,-73.7973130°)"
25745000,CUNDINAMARCA,SIMIJACA,SIMIJACA,ESTATAL,MUNICIPAL,BIBLIOTECA PÚBLICA MUNICIPAL SANTA LUCIA,CALLE 9 N° 7A-37,CENTRO,918555133/918555117/3125748783/8555133,,8555117,www.simijaca.cundinamarca.gov.co,ABIERTA,"(5.5033460°,-73.8517037°)"
25758008,CUNDINAMARCA,SOPO,HATOGRANDE,ESTATAL,RURAL,BIBLIOTECA PÚBLICA HATO GRANDE,HATO GRANDE. SECTOR LOMITAS,LOMITAS,8572969/3214897584/,,,,ABIERTA,"(4.9332900°,-73.9999600°)"
25758000,CUNDINAMARCA,SOPO,VEREDA BRICEÑO,ESTATAL,RURAL,BIBLIOTECA PÚBLICA EDUARDO BRICEÑO,CALLE 7 CARRERA 7,BRICEÑO,8572969/3133241457/3123220637/,,,,ABIERTA,"(4.9127100°,-73.9384400°)"
25758000,CUNDINAMARCA,SOPO,VEREDA EL CHUSCAL,ESTATAL,RURAL,BIBLIOTECA PÚBLICA VEREDA EL CHUSCAL,CARRERA 3 N° 7-38 SUR,EL CHUSCAL,8572969/3133241457/3132097338/8572969,,,,ABIERTA,"(4.8853100°,-73.9522400°)"
25758000,CUNDINAMARCA,SOPO,VEREDA SAN GABRIEL,ESTATAL,RURAL,BIBLIOTECA PÚBLICO RURAL SAN GABRIEL,KIILOMETRO 12 VEREDA SAN GABRIEL/ LOMITAS TOMINEJAS SEDE PREVENCION Y SEGURIDAD,VEREDA SAN GABRIEL,8572969/3133241457/3158434818/8572969,,,,ABIERTA,"(4.8314100°,-73.9883800°)"
25772000,CUNDINAMARCA,SUESCA,SUESCA,ESTATAL,MUNICIPAL,BIBLIOTECA PÚBLICA MUNICIPAL LUIS FELIPE CORTES RODRIGUEZ,CALLE 8 Nº  4- 76,CENTRO,/3014769758/,,,,ABIERTA,"(5.1026257°,-73.7998372°)"
25777000,CUNDINAMARCA,SUPATA,SUPATÁ,ESTATAL,MUNICIPAL,BIBLIOTECA PÚBLICA   DE SUPATA,VEREDA SANTA BARBARA,VEREDA SANTA BARBARA,8479520/523/3202775854/8479520,,,,ABIERTA,"(5.0559200°,-74.2382970°)"
25779000,CUNDINAMARCA,SUSA,SUSA,ESTATAL,MUNICIPAL,BIBLIOTECA PÚBLICA MUNICIPAL DE SUSA,CALLE 3 N° 2-12,SECTOR LETICIA,3102417793/8559010/3102417793/,,,,ABIERTA,"(5.4566900°,-73.8150200°)"
25785000,CUNDINAMARCA,TABIO,TABIO,ESTATAL,MUNICIPAL,BIBLIOTECA PÚBLICA JOAQUIN PIÑEROS CORPAS SEDE LA CABRERA,TABIO VEREDA RIOFRIO SECTOR CABRERA, VEREDA LA CABRERA,/3202220886/,,,,ABIERTA,"(4.9203230°,-74.1024930°)"
25785000,CUNDINAMARCA,TABIO,TABIO,ESTATAL,MUNICIPAL,BIBLIOTECA MUNICIPAL JOAQUIN PIÑEROS CORPAS DE TABIO SEDE JARDIN BOTANICO,VIA TERMALES AL LADO DEL ESTADIO,CENTRO,8647319/3125023887/8647731,,,,ABIERTA,"(4.9152583°,-74.0982098°)"
25797000,CUNDINAMARCA,TENA,TENA,ESTATAL,MUNICIPAL,"BIBLIOTECA PÚBLICA MUNICIPAL DE TENA ""CAPILLA DE LA HACIENDA""",CARRERA 5 N° 4 - 47,CENTRO,3228925130/3228925130/,,,,ABIERTA,"(4.6555253°,-74.3899864°)"
25823000,CUNDINAMARCA,TOPAIPI,TOPAIPÍ,ESTATAL,MUNICIPAL,BIBLIOTECA PÚBLICA MUNICIPAL  DE TOPAIPI,ESCUELA URBANA TOPAIPI - EDUARDO SANTOS CARRERA 10 N° 3ª - 26, TOPAIPI centro,/3125283425/,,,,ABIERTA,"(5.3356930°,-74.3027900°)"
25839000,CUNDINAMARCA,UBALA,UBALÁ,ESTATAL,MUNICIPAL,BIBLIOTECA PÚBLICA HORACIO BEJARANO DIAZ,CALLE 3 N° 3-22,Ubala Cundinamarca,8537000/3133852907/8537196,,,,ABIERTA,"(4.7436164°,-73.5341885°)"
25841000,CUNDINAMARCA,UBAQUE,UBAQUE,ESTATAL,MUNICIPAL,BIBLIOTECA PÚBLICA JAIME PARDO LEAL,CALLE 3 N° 5-60,CENTRO,8487003/3202118159/,,,,ABIERTA,"(4.4841039°,-73.9334133°)"
25845000,CUNDINAMARCA,UNE,UNE,ESTATAL,MUNICIPAL,BIBLIOTECA PÚBLICA MUNICIPAL DE UNE,CARRERA 4 N° 3-25,"CENTRO, PALACIO MUNICIPAL",8488001/3115952142/8488001,20,,,ABIERTA,"(4.4032273°,-74.0249209°)"
25851000,CUNDINAMARCA,UTICA,ÚTICA,ESTATAL,MUNICIPAL,BIBLIOTECA PÚBLICA MUNICIPAL DE UTICA,CALLE 6 ESTACION DEL FERROCARRIL,ESTACION,8460005/3134287366/,,,,ABIERTA,"(5.1883600°,-74.4814100°)"
25506000,CUNDINAMARCA,VENECIA,VENECIA,ESTATAL,MUNICIPAL,BIBLIOTECA PÚBLICA MUNICIPAL LEER PARA CRECER,Calle 3 #3-97,Centro,8681104/3133773534/8681104,,8681104,,ABIERTA,"(4.0870320°,-74.4789790°)"
25862000,CUNDINAMARCA,VERGARA,VERGARA,ESTATAL,MUNICIPAL,BIBLIOTECA PÚBLICA MUNICIPAL DEL MUNICIPIO DE VERGARA,CALLE 3 A # 3-66,JUAN XXIII,3134501712/3202847670/,,,,ABIERTA,"(5.0317079°,-74.2781650°)"
25871000,CUNDINAMARCA,VILLAGOMEZ,VILLAGÓMEZ,ESTATAL,MUNICIPAL,BIBLIOTECA PÚBLICA MUNICIPAL DEL MUNICIPIO DE VILLAGOMEZ,CALLE  5 # 3-55,CENTRO,/3102025199/,,,,ABIERTA,"(5.2743427°,-74.1951575°)"
25873000,CUNDINAMARCA,VILLAPINZON,VILLAPINZÓN,ESTATAL,MUNICIPAL,"BIBLIOTECA PÚBLICA MUNICIPAL ""LUIS ANTONIO ESCOBAR""",CALLE 4 N° 8 - 50 CENTRO LUDICO,20 DE JULIO,8565264/3102064875/,,8565125,,ABIERTA,"(5.2167301°,-73.5994834°)"
25875000,CUNDINAMARCA,VILLETA,VILLETA,ESTATAL,MUNICIPAL,"BIBLIOTECA MUNICIPAL ""ARCADIO PLAZAS""",CALLE 6 N° 8-90,CENTRO,8444512/3154495474/,,,,ABIERTA,"(5.0110271°,-74.4738202°)"
25878000,CUNDINAMARCA,VIOTA,VIOTÁ,ESTATAL,MUNICIPAL,BIBLIOTECA PÚBLICA MUNICIPAL DE VIOTA,CALLE 16 N° 10-43 2°PISO POLIDEPORTIVO MUNICIPAL,Centro,/3124984289/,,,,ABIERTA,"(4.4355499°,-74.5210587°)"
25885000,CUNDINAMARCA,YACOPI,YACOPÍ,ESTATAL,MUNICIPAL,BIBLIOTECA PÚBLICA MUNICIPAL DE YACOPI,CARRERA 3A # 11-12,CHAPINERO,(091) 8546092/ 6093 / 098-3449011/3204819997/,, (091) 8546093,,ABIERTA,"(5.5071250°,-74.2895683°)"
25899000,CUNDINAMARCA,ZIPAQUIRA,ZIPAQUIRÁ,ESTATAL,MUNICIPAL,BIBLIOTECA PÚBLICA REGIONAL DE ZIPAQUIRÁ JOSÉ MARÍA TRIANA ALGARRA,AVENIDA CARRERA 15 N° 1- 06 sur,LA FRAGUITA,3115762035/3115762035 /,,,,ABIERTA,"(5.0207447°,-73.9992518°)"
25899000,CUNDINAMARCA,ZIPAQUIRA,ZIPAQUIRÁ,ESTATAL,MUNICIPAL,BIBLIOTECA PÚBLICA MUNICIPAL EDUARDO CASTILLO,CARRERA 9 # 7 -94,CENTRO,8522248/3102796216/8522248,,,,ABIERTA,"(5.0247669°,-74.0026005°)"
94001000,GUAINIA,INIRIDA,INÍRIDA,ESTATAL,DEPARTAMENTAL,BIBLIOTECA PÚBLICA DEPARTAMENTAL GABRIEL GARCIA MARQUEZ,CALLE 25 N°. 9-31 BARRIO LA PRIMAVERA 1 ETAPA MZ. 004,CENTRO,3103234184/5656075/5656921/3112764418/,,,,ABIERTA,"(3.4658091°,-67.9654169°)"
95001000,GUAVIARE,SAN JOSE DEL GUAVIARE,SAN JOSÉ DEL GUAVIARE,ESTATAL,MUNICIPAL,BIBLIOTECA PÚBLICA MUNICIPAL SAN JOSÉ DEL GUAVIARE,Calle 20 Cra 19,Bello Horizonte,584002/3125423007/,,,http://facebook.com/BPMSanJosedelGuaviare,ABIERTA,"(2.5569050°,-72.6326970°)"
41006000,HUILA,ACEVEDO,ACEVEDO,ESTATAL,MUNICIPAL,BIBLIOTECA PÚBLICA MUNICIPAL DE ACEVEDO,CARRERA 4 # 9-50,CENTRO,/3115442601/,,,,ABIERTA,"(1.8516225°,-76.0367598°)"
41013000,HUILA,AGRADO,AGRADO,ESTATAL,MUNICIPAL,BIBLIOTECA PÚBLICA MUNICIPAL JOSE MARIA ROJAS GARRIDO,CALLE 6 N° 4-14,CENTRO,8322006/3213111561/,,,,ABIERTA,"(2.2557600°,-75.7717000°)"
41016000,HUILA,AIPE,AIPE,ESTATAL,MUNICIPAL,BIBLIOTECA PÚBLICA MUNICIPAL SAÚL PERDOMO RIVERA,CARRERA 10 # 4- 70,AV FUNDADORES,8389368/3223736117/,,,https://www.facebook.com/bibliotecasaul.perdomoriv,ABIERTA,"(3.2211642°,-75.2364423°)"
41078000,HUILA,BARAYA,BARAYA,ESTATAL,MUNICIPAL,BIBLIOTECA PÚBLICA MUNICIPAL ANTONIO PALOMAR AVILES,CALLE 2C N° 5-43,CENTRO DEL POBLADO, 57 (8) 8788716 /3106968829/,,,https://www.facebook.com/biblioteca.antoniopalomar,ABIERTA,"(3.1518988°,-75.0500464°)"
41206000,HUILA,COLOMBIA,COLOMBIA,ESTATAL,MUNICIPAL,BIBLIOTECA PÚBLICA MUNICIPAL DE COLOMBIA,CALLE 6 N° 2 - 70,UNICENTRO,8319697/3107769741/8319760,,,https://www.facebook.com/bibliotecampaldecolombia,ABIERTA,"(3.3851638°,-74.8078988°)"
41244000,HUILA,ELIAS,ELÍAS,ESTATAL,MUNICIPAL,BIBLIOTECA PÚBLICA MUNICIPAL ALFONSO LÓPEZ,CALLE 2 Nº 4-28,CENTRO,/3204702152/,,,,ABIERTA,"(2.0238700°,-75.9454600°)"
41298000,HUILA,GARZON,GARZÓN,ESTATAL,MUNICIPAL,BIBLIOTECA PÚBLICA MUNICIPAL DE GARZON LUIS CALIXTO LEIVA CHARRY ,CALLE 8 CON CARRERA 7 ESQUINA,CENTRO,8332000 /3214095715/,122,8334973,,ABIERTA,"(2.1938785°,-75.6279949°)"
41306000,HUILA,GIGANTE,GIGANTE,ESTATAL,MUNICIPAL,BIBLIOTECA PÚBLICA MUNICIPAL HUMBERTO MONTEALEGRE SÁNCHEZ,CARRERA  8 CON CALLE 2 ESQUINA,LA FLORESTA,/3212520430/,,,,ABIERTA,"(2.3881100°,-75.5433200°)"
41319000,HUILA,GUADALUPE,GUADALUPE,ESTATAL,MUNICIPAL,BIBLIOTECA PÚBLICA MUNICIPAL ALEJANDRINO LIZCANO,CARRERA 6 N° 1 - 05,CENTRO,3204340804/3204340804/,,,,ABIERTA,"(2.0229005°,-75.7549304°)"
41349000,HUILA,HOBO,HOBO,ESTATAL,MUNICIPAL,BIBLIOTECA PÚBLICA DOUGLAS HERNÁN BAUTISTA TOVAR,CARRERA 9° N° 5 - 41,SAN PEDRO,8384006/3212504492/,,,,ABIERTA,"(2.5839300°,-75.4523000°)"
41357000,HUILA,IQUIRA,IQUIRA,ESTATAL,MUNICIPAL,BIBLIOTECA PÚBLICA ALBERTO YUSTRES BARRERA,Carrera: 9  N° 5-52 ,MARIA AUXILIADORA,3123963914/3123963914/8394622,,,https://www.facebook.com/bibliotecaalberto.yustres,ABIERTA,"(2.6486100°,-75.6353300°)"
41359000,HUILA,ISNOS,SAN JOSÉ DE ISNOS,ESTATAL,MUNICIPAL,BIBLIOTECA PÚBLICA MUNICIPAL DE ISNOS,CARRERA 4 N° 5 - 10,CENTRO,3214467302  /3157701075/,,,www.facebook.com/ISNOS.ALCALDIA/?fref=ts,ABIERTA,"(1.9304200°,-76.2154400°)"
41378000,HUILA,LA ARGENTINA,LA ARGENTINA,ESTATAL,MUNICIPAL,BIBLIOTECA PÚBLICA MUNICIPAL LA ARGENTINA,CALLE 5 CON CARRERA 4 ESQUINA SEGUNDO PISO,CENTRO,/3133992276/,,8311608,,ABIERTA,"(2.1965100°,-75.9794700°)"
41396000,HUILA,LA PLATA,LA PLATA,ESTATAL,MUNICIPAL,BIBLIOTECA PÚBLICA DE HUILA SIMON BOLIVAR,CARRERA 4 CON CALLE 5 EDIFICIO PRIMITIVO LOZADA PISO 3,CENTRO,/3183621414/,,,,ABIERTA,"(2.3875178°,-75.8947642°)"
41483000,HUILA,NATAGA,NÁTAGA,ESTATAL,MUNICIPAL,BIBLIOTECA PÚBLICA MUNICIPAL DE NATAGA,CARRERA 8 CON CALLE 5,CRISTO REY,3182475719/3125829651/,,,,ABIERTA,"(2.5441300°,-75.8089100°)"
41001000,HUILA,NEIVA,NEIVA,ESTATAL,MUNICIPAL,BIBLIOTECA MUNICIPAL HUELLAS,Carrera 2 entre calle 8 y 9 local 4041,Centro ,8712439/3188153437/8712439,,,https://www.facebook.com/biblioteca.huellas.1?fref,ABIERTA,"(2.9501484°,-75.2980153°)"
41001000,HUILA,NEIVA,NEIVA,ESTATAL,DEPARTAMENTAL,BIBLIOTECA PÚBLICA DEPARTAMENTAL OLEGARIO RIVERA,CARRERA 5 NO 21-81  CENTRO DE CONVENCIONES JOSE EUSTACIO RIVERA,SEVILLA,8753042 / 3212027264/3103490634/8752995,123,,https://www.facebook.com/Bloque-Cultural-Bibliotec,ABIERTA,"(2.9176198°,-75.2856623°)"
41518000,HUILA,PAICOL,PAICOL,ESTATAL,MUNICIPAL,BIBLIOTECA PÚBLICA MUNICIPAL JESUS ALIRIO OCHOA,CALLE 4 N° 6 - 12,BARRIO LOS ALMENDROS,8378031/3102273621/,,,,ABIERTA,"(2.4481900°,-75.7740000°)"
41524000,HUILA,PALERMO,PALERMO,ESTATAL,MUNICIPAL,BIBLIOTECA PÚBLICA MUNICIPAL JULIAN POLANIA PEREZ,CARRERA 8 N° 9-54,CENTRO,3144015749/3144015749/,,,https://www.facebook.com/bibliotecajulian.polaniap,ABIERTA,"(2.8885141°,-75.4345240°)"
41530000,HUILA,PALESTINA,PALESTINA,ESTATAL,MUNICIPAL,BIBLIOTECA PÚBLICA MUNICIPAL GUSTAVO ADOLFO VIDAL,CALLE 3 N° 3 - 52,JUAN XXIII,8315647/3183234028/,114,,,ABIERTA,"(1.7231600°,-76.1331500°)"
41548000,HUILA,PITAL,PITAL,ESTATAL,MUNICIPAL,BIBLIOTECA PÚBLICA DEL MUNICIPIO DE PITAL,CALLE 6 CON CARRERA 9,CENTRO,8887102/3138778466/,,,,ABIERTA,"(2.2674800°,-75.8058000°)"
41551000,HUILA,PITALITO,PITALITO,ESTATAL,MUNICIPAL,BIBLIOTECA PÚBLICA MUNICIPAL MONSEÑOR ESTEBAN ROJAS,CALLE 6 N° 3 - 48,CENTRO,8360010/3103188241/,121,,,ABIERTA,"(1.8520160°,-76.0454240°)"
41660000,HUILA,SALADOBLANCO,SALADOBLANCO,ESTATAL,MUNICIPAL,BIBLIOTECA PÚBLICA MUNICIPAL ISAIAS PEÑA GUTIEREZ,CARRERA 2 N° 8 - 09,CENTRO,8323013/3202888563/,,8323014,,ABIERTA,"(1.9922600°,-76.0410600°)"
41668000,HUILA,SAN AGUSTIN,SAN AGUSTÍN,ESTATAL,MUNICIPAL,BIBLIOTECA PÚBLICA MUNICIPAL DE SAN AGUSTIN,CARRERA 11 N°  3 - 61,SAN JOSÉ,8373062/3132187209/,,,,ABIERTA,"(1.8830988°,-76.2714631°)"
41799000,HUILA,TELLO,TELLO,ESTATAL,MUNICIPAL,BIBLIOTECA PÚBLICA MUNICIPAL DE TELLO,CARRERA 3A CALLE 4A ESQUINA,CENTRO,/3212352485/3144782800/,,,https://www.facebook.com/julian.tunaUNILATINA,ABIERTA,"(3.0675030°,-75.1355988°)"
41797000,HUILA,TESALIA,TESALIA,ESTATAL,MUNICIPAL,BIBLIOTECA PÚBLICA RÉGULO SUÁREZ,CARRERA 8 N° 6-58,CENTRO,3202005861/3202005861/3158489595,,8377022,https://www.facebook.com/biblioteca.tesaliahuila?f,ABIERTA,"(2.4859100°,-75.7300100°)"
41807000,HUILA,TIMANA,TIMANÁ,ESTATAL,MUNICIPAL,BIBLIOTECA PÚBLICA MUNICIPAL CARLOS ENRIQUE RIVERA ,CARRERA 4 N° 10-5,LA CRUZ,/3142538358/,,,,ABIERTA,"(1.9731600°,-75.9319300°)"
41872000,HUILA,VILLAVIEJA,VILLAVIEJA,ESTATAL,MUNICIPAL,BIBLIOTECA PÚBLICA MUNICIPAL DE VILLAVIEJA,CARRERA 3 N° 3 - 28,CENTRO,8797744/3133508896/,,,https://www.facebook.com/groups/205066673213725/,ABIERTA,"(3.2196778°,-75.2194580°)"
44035000,LA GUAJIRA,ALBANIA,ALBANIA,ESTATAL,MUNICIPAL,BIBLIOTECA PÚBLICA MUNICIPAL DE ALBANIA,CARRERA 3 N° 2-163,CENTRO,/3166252324/,,7775110,,ABIERTA,"(11.1510400°,-72.6075700°)"
44078000,LA GUAJIRA,BARRANCAS,BARRANCAS,ESTATAL,MUNICIPAL,BIBLIOTECA PÚBLICA GABRIEL SOLANO VIDAL,CALLE 11 N° 8-42,CENTRO,/3148041056/7748087,,,,ABIERTA,"(10.9554355°,-72.7899797°)"
44090003,LA GUAJIRA,DIBULLA,MINGUEO,ESTATAL,RESGUARDO INDÍGENA,BIBLIOTECA PÚBLICA RESGUARDO INDÍGENA KOGUI MALAYO ARHUACO,MARGEN DERECHA CUENCA DEL RÍO SANTA CLARA-DUMINGUEKA PUEBLO CULTURAL KOGUI.,DUMINGUEKA,/3114239435/,,,,ABIERTA,"(11.2155800°,-73.4006900°)"
44098000,LA GUAJIRA,DISTRACCION,DISTRACCIÓN,ESTATAL,MUNICIPAL,BIBLIOTECA PÚBLICA CARIDAD SUAREZ DE HERRERA,Calle 10 n. 12 -12,CENTRO,/3205623804/,,,,ABIERTA,"(10.8845500°,-72.8455200°)"
44110000,LA GUAJIRA,EL MOLINO,EL MOLINO,ESTATAL,MUNICIPAL,BIBLIOTECA PÚBLICA MUNICIPAL FERNANDO LOPEZ URBINA,CARRERA 2 N°  19 - 47,EL MILLON,3152226005/3152226005/,,,,ABIERTA,"(10.6542700°,-72.9277800°)"
44279000,LA GUAJIRA,FONSECA,FONSECA,ESTATAL,MUNICIPAL,BIBLIOTECA PÚBLICA CENTRO DE RECURSOS EDUCATIVOS MUNICIPALES,CALLE 10 N° 16 - 118,PLAZA PRINCIPAL,0357756462/3012176715/0357756462,,,,ABIERTA,"(10.8912900°,-72.8537500°)"
44378000,LA GUAJIRA,HATONUEVO,HATONUEVO,ESTATAL,MUNICIPAL,BIBLIOTECA PÚBLICA MUNICIPAL DEL MUNICIPIO DE HATONUEVO,CALLE 14 N° 18-06,EL CARMEN,3172749949/3014093658/,,,,ABIERTA,"(11.0648540°,-72.7652410°)"
44420000,LA GUAJIRA,LA JAGUA DEL PILAR,LA JAGUA DEL PILAR,ESTATAL,MUNICIPAL,BIBLIOTECA PÚBLICA MUNICIPAL ELSA ARMENTA,CARRERA 3 N° 5 - 65,TRANQUILIDAD,3114080089/3114080089/,,,,ABIERTA,"(10.5115300°,-73.0711500°)"
44430002,LA GUAJIRA,MAICAO,CARRAIPÍA,ESTATAL,RURAL,BIBLIOTECA PÚBLICA MUNICIPAL DE CARRAIPÍA,CARRERA 2 CALLA 9 ESQUINA,CENTRO,/3045349406/,,,,ABIERTA,"(11.2539156°,-72.3772398°)"
44430000,LA GUAJIRA,MAICAO,MAICAO,ESTATAL,MUNICIPAL,BIBLIOTECA PÚBLICA DEL MUNICIPIO DE MAICAO (MINISTERIO),CALLE 7 N° 7-08 ESQUINA,EL BOSQUE,57251740/7262614/3007106587/,,,,ABIERTA,"(11.3744227°,-72.2347479°)"
44430000,LA GUAJIRA,MAICAO,MAICAO,ESTATAL,MUNICIPAL,BIBLIOTECA PÚBLICA MUNICIPAL MIGUEL ANGEL LOPEZ HERNANDEZ,CALLE 15 #11-09 ESQUINA,CENTRO,3104568470/3004473676/,,,,ABIERTA,"(11.3644822°,-72.2360386°)"
44430007,LA GUAJIRA,MAICAO,PARAGUACHÓN,ESTATAL,RURAL,BIBLIOTECA PÚBLICA JUAN BAUTISTA LARA DE LUQUEZ,CALLE 2 N° 8B-56,PARAGUACHON,/3023032143/,,,,ABIERTA,"(11.3600215°,-72.1295330°)"
44560000,LA GUAJIRA,MANAURE,MANAURE,ESTATAL,MUNICIPAL,BIBLIOTECA PÚBLICA MUNICIPAL DE MANAURE,CALLE 3 # 06 -02,PORVENIR,/3012025859/,,,,ABIERTA,"(11.7780300°,-72.4457200°)"
44650000,LA GUAJIRA,SAN JUAN DEL CESAR,SAN JUAN DEL CESAR,ESTATAL,MUNICIPAL,BIBLIOTECA PÚBLICA MUNICIPAL MELQUIADES FERNANDEZ MENDOZA,CALLE 6 N° 2-105,CENTRO,7740090/3154098435/7740045,,,,ABIERTA,"(10.7731200°,-73.0020100°)"
44847012,LA GUAJIRA,URIBIA,NAZARETH,ESTATAL,RURAL,BIBLIOTECA PÚBLICA MUNICIPAL CASA DE CULTURA CARLOS EDUARDO AFANADOR,CASA DE LA CULTURA,NAZARETH,3216247259/3216247259/3215988231,,,,ABIERTA,"(12.1834100°,-71.2833400°)"
44847000,LA GUAJIRA,URIBIA,URIBIA,ESTATAL,MUNICIPAL,BIBLIOTECA PÚBLICA MUNICIPAL DE URIBIA VICTOR BARROS,transversal 1 No 1-13,CENTRO,/3158712544/,,,,ABIERTA,"(11.9164527°,-72.0002726°)"
44855000,LA GUAJIRA,URUMITA,URUMITA,ESTATAL,MUNICIPAL,BIBLIOTECA PÚBLICA MUNICIPAL JOSE LORENZO CELEDON BENJUMEA,CARRERA 8A N° 9 ESQUINA,BARRIO SAN ROQUE,7778040/3163107069/,,,,ABIERTA,"(10.4884797°,-72.9696779°)"
44874000,LA GUAJIRA,VILLANUEVA,VILLANUEVA,ESTATAL,MUNICIPAL,BIBLIOTECA PÚBLICA MUNICIPAL LUIS CARLOS LACOUTURE DAZA,CALLE 14 N° 13 - 20,SAN LUIS,/3158497888/3004470903,,,,ABIERTA,"(10.6041900°,-72.9816500°)"
47030000,MAGDALENA,ALGARROBO,ALGARROBO,ESTATAL,MUNICIPAL,"BIBLIOTECA PÚBLICA ""BENITO REBOLLO",calle 9 # 9-34 Algarrobo Magdalena,CENTRO,/3135943964/,,,,ABIERTA,"(10.2953001°,-74.0391920°)"
47053000,MAGDALENA,ARACATACA,ARACATACA,ESTATAL,MUNICIPAL,BIBLIOTECA PÚBLICA MUNICIPAL REMEDIOS LA BELLA,CALLE 6 N° 4 85,CENTRO,095 4270727/3135903880/,,,,ABIERTA,"(10.5921399°,-74.1925279°)"
47058000,MAGDALENA,ARIGUANI,EL DIFICIL,ESTATAL,MUNICIPAL,BIBLIOTECA PÚBLICA MUNICIPAL DE ARIGUANI,CRA 1 A # 25 B. Avenida los estudiantes,Kennedy,(57)(5) 4258265 /3107168092/,,,http://www.ariguani-magdalena.gov.co/index.shtml,ABIERTA,"(9.8532203°,-74.2339594°)"
47161000,MAGDALENA,CERRO SAN ANTONIO,CERRO SAN ANTONIO,ESTATAL,MUNICIPAL,BIBLIOTECA PÚBLICA MUNICIPAL ANTONIO ESTEBAN SANCHEZ JIMENEZ ,CARRERA 4 N°  9A-09,CLAVEL,5091801/3114023623/,,,www.cerrodesanantonio-magdalena.gov.co/,ABIERTA,"(10.3277285°,-74.8812548°)"
47170000,MAGDALENA,CHIBOLO,CHIVOLO,ESTATAL,MUNICIPAL,BIBLIOTECA PÚBLICA JORGE ELIECER QUIROZ MUÑOZ, Calle 10 # 13-23,CENTRO,3217879925/3217879925/,,,,ABIERTA,"(10.0261111°,-74.6211111°)"
47189000,MAGDALENA,CIENAGA,CIÉNAGA,ESTATAL,MUNICIPAL,BIBLIOTECA PÚBLICA MUNICIPAL PEDRO BONETT CAMARGO,CARRERA 10B N° 9-25,CENTENARIO,/3173779844/4103385,,,,ABIERTA,"(11.0103561°,-74.2527044°)"
47205000,MAGDALENA,CONCORDIA,CONCORDIA,ESTATAL,MUNICIPAL,"BIBLIOTECA PÚBLICA MUNICIPAL ""DR. EUGENIO ESCALANTE""",CALLE 3 N° 12-100,LA LOMA,/3205601619/,,,,ABIERTA,"(10.2689790°,-74.8246190°)"
47258000,MAGDALENA,EL PIÑON,EL PIÑON,ESTATAL,MUNICIPAL,BIBLIOTECA PÚBLICA MUNICIPAL DEL MUNICIPIO EL PIÑON,CALLE 14 N° 1-19,CENTRO,3205744666/3104996026/,,,www.elpinon-magdalena.gov.co,ABIERTA,"(10.4593038°,-74.6235808°)"
47268000,MAGDALENA,EL RETEN,EL RETÉN,ESTATAL,MUNICIPAL,BIBLIOTECA PÚBLICA MUNICIPAL DE EL RETEN,Carrera 5 Calle 5 Esquina,CENTRO,/3217241033/,,,,ABIERTA,"(10.6167000°,-74.2667000°)"
47288000,MAGDALENA,FUNDACION,FUNDACIÓN,ESTATAL,MUNICIPAL,BIBLIOTECA PÚBLICA MUNICIPAL CARLOS LOPEZ RIVEIRA,CARRERA 9 N° 10-14,EL CARMEN,4140498/3217658889/,,4140498,,ABIERTA,"(10.5186261°,-74.1857673°)"
47460000,MAGDALENA,NUEVA GRANADA,GRANADA,ESTATAL,MUNICIPAL,BIBLIOTECA PÚBLICA ADALBERTO SAUMET RAMOS,"CALLE 8A - 45, CALLE DEL COMERCIO",BARRIO ALTO PRADO,3012152002/3012152002/,,,,ABIERTA,"(9.8030600°,-74.3903000°)"
47460002,MAGDALENA,NUEVA GRANADA,LA GLORIA,ESTATAL,RURAL,BIBLIOTECA PÚBLICA MUNICIPAL DEL CORREGIMIENTO LA GLORIA,Avenida los andes,Ruta de las Americas,/3216051189/,,,,ABIERTA,"(9.8095900°,-74.3228600°)"
47545000,MAGDALENA,PIJIÑO DEL CARMEN,PIJIÑO,ESTATAL,MUNICIPAL,BIBLIOTECA PÚBLICA MUNICIPAL DIGNO EMERITO FERREIRA,CARRERA 4N-10-15,LAS FLORES,/3205616191/,,,,ABIERTA,"(9.3405880°,-74.4498210°)"
47551000,MAGDALENA,PIVIJAY,PIVIJAY,ESTATAL,MUNICIPAL,BIBLIOTECA PUBLICA MUNICIPAL WENCELL BOLAÑÒ ORDOÑEZ,CALLE 10 N° 13-56,EL JARDIN,/3207482727/,,,,ABIERTA,"(10.4565580°,-74.6235274°)"
47605000,MAGDALENA,REMOLINO,REMOLINO,ESTATAL,MUNICIPAL,BIBLIOTECA PÚBLICA MUNICIPAL DE REMOLINO,CALLE 10 CARRERA 2 ESQUINA,CENTRO,3225760673/3003259372/,,,www.remolino-magdalena.gov.co,ABIERTA,"(10.7009000°,-74.7166200°)"
47675000,MAGDALENA,SALAMINA,SALAMINA,ESTATAL,MUNICIPAL,BIBLIOTECA PÚBLICA MUNICIPAL JOSE NICOMEDES ESCORCIA, CARRERA 7 N° 6-36,CENTRO,/3118028474/,,,,ABIERTA,"(10.4892570°,-74.7954527°)"
47692000,MAGDALENA,SAN SEBASTIAN DE BUENAVISTA,SAN SEBASTIÁN DE BUENAVISTA,ESTATAL,MUNICIPAL,BIBLIOTECA PÚBLICA MUNICIPAL DE SAN SEBASTIAN DE BUENAVISTA,Calle 4 # 12 - 65,CENTRO,/3145549468/,,,,ABIERTA,"(9.2391200°,-74.3520400°)"
47703000,MAGDALENA,SAN ZENON,SAN ZENÓN,ESTATAL,MUNICIPAL,BIBLIOTECA PÚBLICA MUNICIPAL DE SAN ZENON,Cr. 2 N° 15 - 75,San Martin,/3205088531/,,,,ABIERTA,"(9.2437421°,-74.4993210°)"
47720000,MAGDALENA,SANTA BARBARA DE PINTO,SANTA BÁRBARA DE PINTO,ESTATAL,MUNICIPAL,BIBLIOTECA PÚBLICA MUNICIPAL MIRIAN PIEDRAHITA,URBANIZACION SAN JOSE CENTRO CULTURAL/SANTA BARBARA DE PINTO,SAN JOSE,"3218551453
/3126501200/",,,,ABIERTA,"(9.3827300°,-74.6405100°)"
47001038,MAGDALENA,SANTA MARTA,VALLE DE GAIRA,COMUNITARIA,MUNICIPAL,BIBLIOTECA PÚBLICA POPULAR DE GAIRA,CALLE 14 N° 12A-49,Gaira,3013971378/3013971378/,,,,ABIERTA,"(11.1980881°,-74.2267085°)"
47745000,MAGDALENA,SITIONUEVO,SITIONUEVO,ESTATAL,MUNICIPAL,BIBLIOTECA PÚBLICA MUNICIPAL HILDA TORREGROSA,Calle 3 No. 8 Casa de la Cultura,,4146071 /4146080/3205093470/,,,,ABIERTA,"(10.7756500°,-74.6811600°)"
47798000,MAGDALENA,TENERIFE,TENERIFE,ESTATAL,MUNICIPAL,"BIBLIOTECA PÚBLICA MUNICIPAL""JOSE MARIA DIAZ FANDIÑO""",CALLE 9 N° 1 - 18,SECTOR TEMPLO PARROQUIAL,3205093470/3046023202/,,,,ABIERTA,"(10.0002120°,-74.6665620°)"
47980011,MAGDALENA,ZONA BANANERA,VARELA,ESTATAL,RURAL,BIBLIOTECA PÚBLICA MUNICIPAL DE VARELA,CARRERA 4 N° 5- 58,Porvenir,/3004819444/,,,,CERRADA TEMPORALMENTE,"(10.8833300°,-74.1666400°)"
50006000,META,ACACIAS,ACACÍAS,ESTATAL,MUNICIPAL,BIBLIOTECA PÚBLICA CARLOS MARÍA HERNÁNDEZ ROJAS,AVENIDA 23 N° 27-14 BARRIO LA TIZA,LA TIZA,098 6561123/3103345211/6561123,,,,ABIERTA,"(3.9996200°,-73.7682600°)"
50110000,META,BARRANCA DE UPIA,BARRANCA DE UPÍA,ESTATAL,MUNICIPAL,BIBLIOTECA PÚBLICA MUNICIPAL DE BARRANCA DE UPIA,CALLE 7 N° 3-77,BARRIO LIBERTAD II,/3102566560/,,,,ABIERTA,"(4.5684628°,-72.9633644°)"
50124000,META,CABUYARO,CABUYARO,ESTATAL,MUNICIPAL,BIBLIOTECA PÚBLICA MUNICIPAL DE CABUYARO,CARRERA 7 # 8 -15,JUAN PABLO II,/3132431946/,,,,ABIERTA,"(4.2850852°,-72.7939706°)"
50150000,META,CASTILLA LA NUEVA,CASTILLA LA NUEVA,ESTATAL,MUNICIPAL,BIBLIOTECA PÚBLICA SAN LORENZO CASTILLA LA NUEVA,KRA 3NRO 2-27-29 35,VEREDA SAN LORENZO,6750075/3196089443/0386750076,,,,ABIERTA,"(3.8144000°,-73.5291800°)"
50223000,META,CUBARRAL,SAN LUIS DE CUBARRAL,ESTATAL,MUNICIPAL,BIBLIOTECA PÚBLICA MUNICIPAL DEL MUNICIPIO DE CUBARRAL,CALLE 9 N°8-08,CENTRO,3202717752/3146418776/,,,,ABIERTA,"(3.7943800°,-73.8378900°)"
50226000,META,CUMARAL,CUMARAL,ESTATAL,MUNICIPAL,BIBLIOTECA PÚBLICA MUNICIPAL ÁLVARO GARZÓN TORRES,CALLE 13 con CARRERA 21-10 Esquina,TRIUNFO,6871188/3132622824/,,,,ABIERTA,"(4.2682692°,-73.4896946°)"
50245000,META,EL CALVARIO,EL CALVARIO,ESTATAL,MUNICIPAL,"BIBLIOTECA PÚBLICA MUNICIPAL FLORA LELYS JARA BRAVO ,  EL CALVARIO",CALLE 6 N° 5-124,La violeta,3102875757/3102875757/,,,,ABIERTA,"(4.3896800°,-73.7741600°)"
50270000,META,EL DORADO,EL DORADO,ESTATAL,MUNICIPAL,BIBLIOTECA PÚBLICA MUNICIPAL DEL MUNICIPIO EL DORADO,CARRERA 5 N° 6-25 CENTRO,CENTRO,3124618091/3124618091/,,,,ABIERTA,"(3.7377590°,-73.8345190°)"
50287000,META,FUENTE DE ORO,FUENTE DE ORO,ESTATAL,MUNICIPAL,"BIBLIOTECA PÚBLICA MUNICIPAL ""HENRY LLANOS GARCÍA""",CALLE 7A CON CARRERA 14 Y 15,BARRIO LA PRIMAVERA,/3134418304/,,,,ABIERTA,"(3.5315255°,-73.7007343°)"
